번호,개방자치단체코드,소재지전화,주소,사업장명,진료과목내용,진료과목내용명
2283,3310000,051-774-1004,부산광역시 남구 수영로 164 (대연동),의료법인은경의료재단 인창대연요양병원,308 306 305 304 303 302 301 122 120 119 116 115 114 113 111 110 102 101,"내과, 신경과, 산부인과, 소아청소년과, 이비인후과, 피부과, 비뇨의학과, 영상의학과, 진단검사의학과, 재활의학과, 가정의학과, 한방내과, 한방부인과, 한방소아과, 한방안·이비인후·피부과, 한방신경정신과, 한방재활의학과, 침구과"
2284,3310000,633-2875,"부산광역시 남구 전포대로 90, 4층 401,402호 (문현동)",우리들40플란트치과병원,411 410 409 408 407 406 405 404 403,"치과보철과, 치과교정과, 소아치과, 치주과, 치과보존과, 구강내과, 영상치의학과, 구강병리과, 예방치과"
2285,3270000,051-932-3000,부산광역시 동구 고관로 81 (수정동),우리한방병원,120 301 302 303 304 305 306 307 308,"재활의학과, 한방내과, 한방부인과, 한방소아과, 한방안·이비인후·피부과, 한방신경정신과, 한방재활의학과, 사상체질과, 침구과"
2286,3250000,051-465-8801,부산광역시 중구 중구로 121 (대청동4가),재단법인천주교부산교구유지재단 메리놀병원,411 410 409 408 407 406 405 404 403 402 122 120 119 118 117 116 115 114 113 112 111 110 109 107 106 105 104 103 102 101,"내과, 신경과, 정신건강의학과, 외과, 정형외과, 신경외과, 흉부외과, 마취통증의학과, 산부인과, 소아청소년과, 안과, 이비인후과, 피부과, 비뇨의학과, 영상의학과, 방사선종양학과, 병리과, 진단검사의학과, 재활의학과, 가정의학과, 구강악안면외과, 치과보철과, 치과교정과, 소아치과, 치주과, 치과보존과, 구강내과, 영상치의학과, 구강병리과, 예방치과"
2287,3360000,051-717-0230,"부산광역시 강서구 명지국제8로 240, 402,501,601호 (명지동, 국제메디칼빌딩)",명지아동병원,114 111 101,"내과, 소아청소년과, 피부과"
2288,3360000,051-271-7528,"부산광역시 강서구 명지오션시티4로 70, 601호 (명지동, NC TOWER)",오션시티치과병원,401 402 403 404 405 406 407 408 409 411,"치과, 구강악안면외과, 치과보철과, 치과교정과, 소아치과, 치주과, 치과보존과, 구강내과, 영상치의학과, 예방치과"
2289,3310000,051-638-7575,부산광역시 남구 수영로 185-7 (대연동),윌리스요양병원,101 111 120 122 105 102 301 306 304 302 305 308,"내과, 신경과, 정형외과, 소아청소년과, 재활의학과, 가정의학과, 한방내과, 한방부인과, 한방안·이비인후·피부과, 한방신경정신과, 한방재활의학과, 침구과"
2290,3310000,051-612-0075,부산광역시 남구 황령대로 355-14 (대연동),그랜드자연요양병원,101 104 105 120 122 308,"내과, 외과, 정형외과, 재활의학과, 가정의학과, 침구과"
2291,3310000,051-633-6665,부산광역시 남구 수영로 165 (대연동),BH병원,103,정신건강의학과
2292,3310000,612-7582,"부산광역시 남구 수영로 228, 3-7층 (대연동)",부산아동병원,111,소아청소년과
2293,3310000,051-633-1123~5,"부산광역시 남구 수영로 175 (대연동, SMG빌딩)",부산성소병원,123 122 116 113 109 106 105 104 102 101,"내과, 신경과, 외과, 정형외과, 신경외과, 마취통증의학과, 이비인후과, 영상의학과, 가정의학과, 핵의학과"
2294,3310000,051-625-3001,부산광역시 남구 신선로 429 (용당동),용당요양병원,106 125 101 104 122 308 301,"내과, 외과, 신경외과, 가정의학과, 응급의학과, 한방내과, 침구과"
2295,3310000,051-928-9000,부산광역시 남구 수영로 241 (대연동),위대항병원,101 104,"내과, 외과"
2296,3310000,051-644-7733,부산광역시 남구 우암양달로75번길 29 (우암동),제니스파크요양병원,101 102 104 105 110 113 115 120 301 304,"내과, 신경과, 외과, 정형외과, 산부인과, 이비인후과, 비뇨의학과, 재활의학과, 한방내과, 한방안·이비인후·피부과"
2297,3310000,051-647-7007,"부산광역시 남구 용호로 132, 용성빌딩3,4층 (용호동)",임해누리의료소비자생활협동조합 오륙도요양병원,122 101 102 103 301,"내과, 신경과, 정신건강의학과, 가정의학과, 한방내과"
2298,3310000,051-628-6005,부산광역시 남구 석포로26번길 17 (감만동),새라새요양병원,122 120 105 101 102 114 111 301 306 308,"내과, 신경과, 정형외과, 소아청소년과, 피부과, 재활의학과, 가정의학과, 한방내과, 한방재활의학과, 침구과"
2299,3260000,247-0119,"부산광역시 서구 보수대로 9, 4~12층 (충무동1가)",바른병원,101 102 104 105 106 109 116 119 120,"내과, 신경과, 외과, 정형외과, 신경외과, 마취통증의학과, 영상의학과, 진단검사의학과, 재활의학과"
2300,3260000,051-291-0707,부산광역시 서구 대신공원로 39 (서대신동3가),엘앤더슨병원,308 301 122 114 109 104 101,"내과, 외과, 마취통증의학과, 피부과, 가정의학과, 한방내과, 침구과"
2301,3330000,051-704-8661,"부산광역시 해운대구 해운대로 802, 10층 (좌동)",새생명요양병원,101 122 301 302 303 304 305 306 307 308 309,"내과, 가정의학과, 한방내과, 한방부인과, 한방소아과, 한방안·이비인후·피부과, 한방신경정신과, 한방재활의학과, 사상체질과, 침구과, 한방응급과"
2302,3330000,051-797-0100,부산광역시 해운대구 해운대로 875 (좌동),인제대학교 해운대백병원,404 403 402 125 124 123 122 120 119 118 117 116 115 114 113 112 111 110 109 108 107 106 105 104 103 102 101,"내과, 신경과, 정신건강의학과, 외과, 정형외과, 신경외과, 흉부외과, 성형외과, 마취통증의학과, 산부인과, 소아청소년과, 안과, 이비인후과, 피부과, 비뇨의학과, 영상의학과, 방사선종양학과, 병리과, 진단검사의학과, 재활의학과, 가정의학과, 핵의학과, 직업환경의학과, 응급의학과, 구강악안면외과, 치과보철과, 치과교정과"
2303,3330000,051-744-0123,"부산광역시 해운대구 좌동순환로 502, 1층일부, 3~9층 (중동)",해운대나눔과행복병원,101 110 116 120 122 301 302 303 304 305 306 308,"내과, 산부인과, 영상의학과, 재활의학과, 가정의학과, 한방내과, 한방부인과, 한방소아과, 한방안·이비인후·피부과, 한방신경정신과, 한방재활의학과, 침구과"
2304,3330000,051-702-7017,"부산광역시 해운대구 좌동로 88, 8층 (좌동, 울트라타워)",김&정해운대병원,101 102 104 105 106 109 120,"내과, 신경과, 외과, 정형외과, 신경외과, 마취통증의학과, 재활의학과"
2305,3330000,702-7994,"부산광역시 해운대구 좌동순환로 247, 2층, 6-9층 (좌동)",우정요양병원,101 102 103 104 105 106 120 122 301 302 306 308,"내과, 신경과, 정신건강의학과, 외과, 정형외과, 신경외과, 재활의학과, 가정의학과, 한방내과, 한방부인과, 한방재활의학과, 침구과"
2306,3330000,780-5555,부산광역시 해운대구 해운대로469번가길 77 (우동),부산노인전문제3병원,101 102 104 120 122 105 106 103,"내과, 신경과, 정신건강의학과, 외과, 정형외과, 신경외과, 재활의학과, 가정의학과"
2307,3330000,743-1588,"부산광역시 해운대구 해운대로 407, 6층 (우동, 신세계프라자)",센텀아동병원,111 101 112 113 105 114 115 116 119,"내과, 정형외과, 소아청소년과, 안과, 이비인후과, 피부과, 비뇨의학과, 영상의학과, 진단검사의학과"
2308,3330000,051-782-2825,"부산광역시 해운대구 센텀동로 102, 센텀필1 2층 208호~213호호 (재송동)",세계로치과병원,401 402 406 412,"치과, 구강악안면외과, 치주과, 통합치의학과"
2309,3330000,051-715-6000,"부산광역시 해운대구 달맞이길117번나길 174 (중동, 아식스신발연구소)",의료법인 해올의료재단 힐마루요양병원,308 307 305 304 303 302 301 122 117 101,"내과, 방사선종양학과, 가정의학과, 한방내과, 한방부인과, 한방소아과, 한방안·이비인후·피부과, 한방신경정신과, 사상체질과, 침구과"
2310,3330000,051-702-6000,"부산광역시 해운대구 세실로 31, 대승프라임 6층 (좌동)",의료법인 한세의료재단 한세병원,126 124 120 109 101,"내과, 마취통증의학과, 재활의학과, 직업환경의학과, 예방의학과"
2311,3330000,051-714-3501,"부산광역시 해운대구 좌동순환로 505, 센트럴메디타워 3층일부,11층일부,12.13층호 (중동)",해운대푸른바다어린이병원,122 120 119 116 114 113 111 105 104 103 101,"내과, 정신건강의학과, 외과, 정형외과, 소아청소년과, 이비인후과, 피부과, 영상의학과, 진단검사의학과, 재활의학과, 가정의학과"
2312,3330000,051-781-9194,부산광역시 해운대구 해운대로161번길 40 (재송동),센텀힐병원,122 120 119 116 115 114 113 111 106 105 104 101,"내과, 외과, 정형외과, 신경외과, 소아청소년과, 이비인후과, 피부과, 비뇨의학과, 영상의학과, 진단검사의학과, 재활의학과, 가정의학과"
2313,3330000,051-791-5101,"부산광역시 해운대구 해운대로 793, 해운대자생한방병원 (좌동)",해운대자생한방병원,308 306 305 304 301 116,"영상의학과, 한방내과, 한방안·이비인후·피부과, 한방신경정신과, 한방재활의학과, 침구과"
2314,3340000,051-204-9998,"부산광역시 사하구 감천로 125 (감천동, 우리빌딩)",의료법인 성원의료재단 감천참편한요양병원,308 306 305 303 302 301 122 120 115 114 113 111 109 106 105 104 101,"내과, 외과, 정형외과, 신경외과, 마취통증의학과, 소아청소년과, 이비인후과, 피부과, 비뇨의학과, 재활의학과, 가정의학과, 한방내과, 한방부인과, 한방소아과, 한방신경정신과, 한방재활의학과, 침구과"
2315,3340000,051)293-7766,부산광역시 사하구 감천로 59 (감천동),의료법인양경의료재단 중앙U병원,101 104 105 109 116 102 122,"내과, 신경과, 외과, 정형외과, 마취통증의학과, 영상의학과, 가정의학과"
2316,3340000,209-6000,"부산광역시 사하구 낙동남로 1412, 경부빌딩 2,3,5층 (하단동)",굿윌치과병원,412 411 409 408 407 406 404 403 402,"구강악안면외과, 치과보철과, 치과교정과, 치주과, 치과보존과, 구강내과, 영상치의학과, 예방치과, 통합치의학과"
2317,3330000,051-791-1006,"부산광역시 해운대구 해운대로 794, 7~8층 (좌동, 삼정엘리움)",엘리움병원,113 111 101,"내과, 소아청소년과, 이비인후과"
2318,3330000,051-743-5555,"부산광역시 해운대구 좌동순환로 462, 지하1층-지상7층 (중동, 성심병원)",해운대성심요양병원,308 307 306 305 304 303 302 301 122 115 114 111 109 106 105 104 102 101,"내과, 신경과, 외과, 정형외과, 신경외과, 마취통증의학과, 소아청소년과, 피부과, 비뇨의학과, 가정의학과, 한방내과, 한방부인과, 한방소아과, 한방안·이비인후·피부과, 한방신경정신과, 한방재활의학과, 사상체질과, 침구과"
2319,3290000,051-638-8000,"부산광역시 부산진구 중앙대로 605, 지상1층~지상9층 (범천동)",학교법인 춘해병원,122 119 116 115 113 110 109 106 105 104 102 101,"내과, 신경과, 외과, 정형외과, 신경외과, 마취통증의학과, 산부인과, 이비인후과, 비뇨의학과, 영상의학과, 진단검사의학과, 가정의학과"
2320,3290000,051-890-6114,"부산광역시 부산진구 복지로 75, 진사로83번길 81, 1층(일부), 3층 (개금동)",인제대학교부산백병원,408 402 126 125 124 123 122 120 119 118 117 116 115 114 113 112 111 110 109 108 107 106 105 104 103 102 101,"내과, 신경과, 정신건강의학과, 외과, 정형외과, 신경외과, 흉부외과, 성형외과, 마취통증의학과, 산부인과, 소아청소년과, 안과, 이비인후과, 피부과, 비뇨의학과, 영상의학과, 방사선종양학과, 병리과, 진단검사의학과, 재활의학과, 가정의학과, 핵의학과, 직업환경의학과, 응급의학과, 예방의학과, 구강악안면외과, 구강내과"
2321,3290000,051-645-9771,"부산광역시 부산진구 범일로 133, 135, 3층 일부, 4층 전부, 5층 일부 (범천동)",성가병원,101 105 106 110 114 111 115 118 104 108 119,"내과, 외과, 정형외과, 신경외과, 성형외과, 산부인과, 소아청소년과, 피부과, 비뇨의학과, 병리과, 진단검사의학과"
2322,3290000,051-867-5101,"부산광역시 부산진구 양정로 62, 지상2ㆍ3ㆍ10층 각 일부/ 지하1ㆍ지상1ㆍ지상4~지상8층 전층 (양정동)",학교법인)동의병원,101 102 103 104 105 106 107 109 110 111 112 113 115 116 118 119 120 122 125 401,"내과, 신경과, 정신건강의학과, 외과, 정형외과, 신경외과, 흉부외과, 마취통증의학과, 산부인과, 소아청소년과, 안과, 이비인후과, 비뇨의학과, 영상의학과, 병리과, 진단검사의학과, 재활의학과, 가정의학과, 응급의학과, 치과"
2323,3290000,051-867-5101,"부산광역시 부산진구 양정로 62, 지상2층 일부, 지상3층 일부, 지상9층 전부, 지상10층 일부 (양정동)",동의대부속 한방병원,301 302 303 304 305 306 307 308,"한방내과, 한방부인과, 한방소아과, 한방안·이비인후·피부과, 한방신경정신과, 한방재활의학과, 사상체질과, 침구과"
2324,3290000,051-817-7575,"부산광역시 부산진구 새싹로 107, 지하1층~지상6층층 (부암동)",한사랑요양병원,301 122 110 105 101,"내과, 정형외과, 산부인과, 가정의학과, 한방내과"
2325,3290000,051-850-0800,"부산광역시 부산진구 중앙대로 910, 지상1~11층 (양정동)",오성병원,116 115 109 106 105 102 101,"내과, 신경과, 정형외과, 신경외과, 마취통증의학과, 비뇨의학과, 영상의학과"
2326,3290000,051-817-5678,"부산광역시 부산진구 백양산로53번길 18, 당감트리플타워A (부암동)",의료법인제영의료재단 다나사요양병원,101 102 104 105 106 120 122 301 308,"내과, 신경과, 외과, 정형외과, 신경외과, 재활의학과, 가정의학과, 한방내과, 침구과"
2327,3290000,051-807-5678,부산광역시 부산진구 성지곡로51번길 28-6 (초읍동),사단법인새길재단 패밀리요양병원,101 102 106 120 301 308,"내과, 신경과, 신경외과, 재활의학과, 한방내과, 침구과"
2328,3290000,051-607-0133,"부산광역시 부산진구 가야대로 721, 719, 767 (당감동)",의료법인 온그룹의료재단 온종합병원,101 102 103 104 105 106 107 108 109 110 111 112 113 115 116 117 118 119 120 122 124 125 126 402 403,"내과, 신경과, 정신건강의학과, 외과, 정형외과, 신경외과, 흉부외과, 성형외과, 마취통증의학과, 산부인과, 소아청소년과, 안과, 이비인후과, 비뇨의학과, 영상의학과, 방사선종양학과, 병리과, 진단검사의학과, 재활의학과, 가정의학과, 직업환경의학과, 응급의학과, 예방의학과, 구강악안면외과, 치과보철과"
2329,3290000,051-582-7001,"부산광역시 부산진구 개금온정로 5, 지하1,지상3층 (개금동, 성원상떼뷰)",(의)영님의료재단 개금중앙요양병원,402 401 301 122 111 109 106 105 104 101,"내과, 외과, 정형외과, 신경외과, 마취통증의학과, 소아청소년과, 가정의학과, 한방내과, 치과, 구강악안면외과"
2330,3340000,051-997-0001,부산광역시 사하구 하신중앙로 7 (장림동),의료법인호산나의료재단현대요양병원,101 105 106 114 301 308,"내과, 정형외과, 신경외과, 피부과, 한방내과, 침구과"
2331,3340000,051-262-3457,"부산광역시 사하구 다대로 544, 3-4층 (다대동, 진요빌딩)",라파요양병원,101 102 104 105 122 301 306 308,"내과, 신경과, 외과, 정형외과, 가정의학과, 한방내과, 한방재활의학과, 침구과"
2332,3340000,051-271-8275,"부산광역시 사하구 낙동대로 451, 금동빌딩 2,4,5-8층 (하단동)",부산맘아동병원,111 113 114 115 101,"내과, 소아청소년과, 이비인후과, 피부과, 비뇨의학과"
2333,3290000,051-757-5119,"부산광역시 부산진구 봉수로 18, 지상 1층 일부, 2층 일부, 3층 일부 (전포동)",의)청십자의료재단 행복한병원,122 120 114 111 102 101,"내과, 신경과, 소아청소년과, 피부과, 재활의학과, 가정의학과"
2334,3290000,051-819-0173,"부산광역시 부산진구 중앙대로 805, 지하2~지상10 층 (부전동)",세흥병원,116 109 106 105 101,"내과, 정형외과, 신경외과, 마취통증의학과, 영상의학과"
2335,3330000,051-608-7000,"부산광역시 해운대구 APEC로 17, 센텀리더스마크, 1.2층일부, 3층, 5~8층 (우동)",센텀이루다요양병원,120 105 106 102 101 122 111 115 113 114 301 302 303 304 306 305 307 308,"내과, 신경과, 정형외과, 신경외과, 소아청소년과, 이비인후과, 피부과, 비뇨의학과, 재활의학과, 가정의학과, 한방내과, 한방부인과, 한방소아과, 한방안·이비인후·피부과, 한방신경정신과, 한방재활의학과, 사상체질과, 침구과"
2336,3330000,051-746-7272,"부산광역시 해운대구 해운대로 575, 2~5층 (우동, 국제빌딩)",밝은마음병원,102 103,"신경과, 정신건강의학과"
2337,3330000,602-8000,부산광역시 해운대구 해운대로 584 (우동),의료법인 인당의료재단 해운대부민병원,407 406 405 403 125 122 119 116 115 111 110 109 106 105 104 103 102 101,"내과, 신경과, 정신건강의학과, 외과, 정형외과, 신경외과, 마취통증의학과, 산부인과, 소아청소년과, 비뇨의학과, 영상의학과, 진단검사의학과, 가정의학과, 응급의학과, 치과보철과, 소아치과, 치주과, 치과보존과"
2338,3370000,051-867-4428,부산광역시 연제구 쌍미천로84번길 37 (연산동),의료법인 황산의료재단 황산요양병원,101 102 103 105 122 301 308,"내과, 신경과, 정신건강의학과, 정형외과, 가정의학과, 한방내과, 침구과"
2339,3370000,051-507-3000,"부산광역시 연제구 월드컵대로 359 (거제동, 1동, 5동일부)",부산광역시의료원,101 104 110 118 114 119 401 105 115 109 116 111 102 103 112 106 107 122 113 120 125,"내과, 신경과, 정신건강의학과, 외과, 정형외과, 신경외과, 흉부외과, 마취통증의학과, 산부인과, 소아청소년과, 안과, 이비인후과, 피부과, 비뇨의학과, 영상의학과, 병리과, 진단검사의학과, 재활의학과, 가정의학과, 응급의학과, 치과"
2340,3370000,051-866-5050,"부산광역시 연제구 배산북로 50 (연산동, 배산북로 47)",성은의료재단 연산병원,119 116 103 102,"신경과, 정신건강의학과, 영상의학과, 진단검사의학과"
2341,3370000,051-862-2002,부산광역시 연제구 고분로 6 (연산동),연제일신병원,119 116 111 110 109 104 101,"내과, 외과, 마취통증의학과, 산부인과, 소아청소년과, 영상의학과, 진단검사의학과"
2342,3370000,051-852-8275,부산광역시 연제구 반송로 52 (연산동),웰니스병원,122 118 116 115 114 110 104 101,"내과, 외과, 산부인과, 피부과, 비뇨의학과, 영상의학과, 병리과, 가정의학과"
2343,3370000,051-607-2075-8,부산광역시 연제구 월드컵대로 359 (거제동),부산노인전문제2병원,308 301 122 120 106 105 104 103 102 101,"내과, 신경과, 정신건강의학과, 외과, 정형외과, 신경외과, 재활의학과, 가정의학과, 한방내과, 침구과"
2344,3340000,051)713-2000,"부산광역시 사하구 낙동남로 1412, 13~15층 (하단동, 경부빌딩)",아주재활병원,120 122 101 105 106 109,"내과, 정형외과, 신경외과, 마취통증의학과, 재활의학과, 가정의학과"
2345,3340000,051-208-9900,부산광역시 사하구 낙동대로 377 (당리동),청림요양병원,101 105 106 111 113 114 116 119 122 301 308,"내과, 정형외과, 신경외과, 소아청소년과, 이비인후과, 피부과, 영상의학과, 진단검사의학과, 가정의학과, 한방내과, 침구과"
2346,3340000,051-293-0013,부산광역시 사하구 옥천로 38 (감천동),의료법인 진연의료재단 감천문화요양병원,308 301 122 113 110 109 106 105 102 101,"내과, 신경과, 정형외과, 신경외과, 마취통증의학과, 산부인과, 이비인후과, 가정의학과, 한방내과, 침구과"
2347,3340000,051-208-7500,부산광역시 사하구 원양로 400 (감천동),의료법인한우리의료재단 한우리요양병원,101 104 105 106 120 301 308,"내과, 외과, 정형외과, 신경외과, 재활의학과, 한방내과, 침구과"
2348,3340000,051-260-1000,부산광역시 사하구 다대로 565 (다대동),의료법인성신의료재단 다대수병원,120 116 111 109 106 105 104 102 101,"내과, 신경과, 외과, 정형외과, 신경외과, 마취통증의학과, 소아청소년과, 영상의학과, 재활의학과"
2349,3340000,202-1370,부산광역시 사하구 동매로44번길 4 (하단동),부산노인전문제4병원,308 301 122 120 111 106 102 101,"내과, 신경과, 신경외과, 소아청소년과, 재활의학과, 가정의학과, 한방내과, 침구과"
2350,3340000,294-8330,부산광역시 사하구 비봉로 70 (신평동),허브휴양  한방병원,308 307 305 304 301 120 106 105 102 101,"내과, 신경과, 정형외과, 신경외과, 재활의학과, 한방내과, 한방안·이비인후·피부과, 한방신경정신과, 사상체질과, 침구과"
2351,3340000,051-600-3800,부산광역시 사하구 다대로 616 (다대동),선안요양병원,301 122 110 104 102 101,"내과, 신경과, 외과, 산부인과, 가정의학과, 한방내과"
2352,3340000,051-203-0288,부산광역시 사하구 하신중앙로 174 (신평동),큰사랑요양병원,301 122 120 111 110 105 104 102 101,"내과, 신경과, 외과, 정형외과, 산부인과, 소아청소년과, 재활의학과, 가정의학과, 한방내과"
2353,3340000,051-201-5275,부산광역시 사하구 사하로 188 (괴정동),괴정어린이병원,113 111 101,"내과, 소아청소년과, 이비인후과"
2354,3340000,791-2222,부산광역시 사하구 다대로 607 (다대동),의료법인 굿타임의료재단 타임요양병원,301 122 120 109 106 105 104 102 101,"내과, 신경과, 외과, 정형외과, 신경외과, 마취통증의학과, 재활의학과, 가정의학과, 한방내과"
2355,3370000,051-759-9119,"부산광역시 연제구 과정로 130 (연산동, 1층(일부제외)∼8층)",우리행복요양병원,106 105 101 104 102 109 111 115 116 120 122 114 119 301 308,"내과, 신경과, 외과, 정형외과, 신경외과, 마취통증의학과, 소아청소년과, 피부과, 비뇨의학과, 영상의학과, 진단검사의학과, 재활의학과, 가정의학과, 한방내과, 침구과"
2356,3290000,051-806-1190,"부산광역시 부산진구 새싹로 286, 4~9층 (초읍동)",가족사랑 요양병원,101 104 114 105 122 110 115 102 109 304,"내과, 신경과, 외과, 정형외과, 마취통증의학과, 산부인과, 피부과, 비뇨의학과, 가정의학과, 한방안·이비인후·피부과"
2357,3290000,051-803-9000,"부산광역시 부산진구 가야대로 713, 2~8, 10, 11~15층 (당감동)",휴병원,120 116 109 106 105 104 101,"내과, 외과, 정형외과, 신경외과, 마취통증의학과, 영상의학과, 재활의학과"
2358,3370000,866-2800,부산광역시 연제구 중앙대로 1064 (연산동),새항운병원,101 104 111 114 107 105 106 108 115 116 118 122,"내과, 외과, 정형외과, 신경외과, 흉부외과, 성형외과, 소아청소년과, 피부과, 비뇨의학과, 영상의학과, 병리과, 가정의학과"
2359,3390000,051-312-2288,부산광역시 사상구 학감대로39번길 104-36 (학장동),부산시립정신병원,103,정신건강의학과
2360,3390000,051-601-6000,부산광역시 사상구 백양대로 420 (주례동),한국보훈복지의료공단 부산보훈병원,101 111 103 104 105 110 113 116 119 122 102 114 120 106 109 112 115 118 202 301,"내과, 신경과, 정신건강의학과, 외과, 정형외과, 신경외과, 마취통증의학과, 산부인과, 소아청소년과, 안과, 이비인후과, 피부과, 비뇨의학과, 영상의학과, 병리과, 진단검사의학과, 재활의학과, 가정의학과, 치과보철과, 한방내과"
2361,3390000,051-324-2227,부산광역시 사상구 학감대로39번길 116 (학장동),의료법인 길정의료재단 대남병원,122 103 102 101,"내과, 신경과, 정신건강의학과, 가정의학과"
2362,3390000,051-322-2875,"부산광역시 사상구 가야대로 276, 1~2층 (주례동, M-square 메디컬센터)",엘리트치과병원,403 404 406 407 408 411,"치과보철과, 치과교정과, 치주과, 치과보존과, 구강내과, 예방치과"
2363,3390000,051-305-7001,부산광역시 사상구 삼덕로5번길 85 (삼락동),의료법인주현의료재단사상중앙병원,101 105 103,"내과, 정신건강의학과, 정형외과"
2364,3390000,051-327-9000,부산광역시 사상구 대동로 2 (엄궁동),의료법인 강혜의료재단 사랑의요양병원,301 122 120 115 114 111 105 104 103 102 101,"내과, 신경과, 정신건강의학과, 외과, 정형외과, 소아청소년과, 피부과, 비뇨의학과, 재활의학과, 가정의학과, 한방내과"
