번호,개방자치단체코드,소재지전화,주소,사업장명,진료과목내용,진료과목내용명
1155,5250000,054-785-7000,경상북도 울진군 울진읍 현내항길 71,울진군의료원,125 122 120 116 115 114 113 112 111 110 109 105 104 102 101,"내과, 신경과, 외과, 정형외과, 마취통증의학과, 산부인과, 소아청소년과, 안과, 이비인후과, 피부과, 비뇨의학과, 영상의학과, 재활의학과, 가정의학과, 응급의학과"
1156,5250000,054-785-7005,경상북도 울진군 울진읍 현내항길 71,울진군의료원요양병원,107 106,"신경외과, 흉부외과"
1157,5250000,054-788-9090,경상북도 울진군 후포면 동해대로 441,의료법인동제의료재단 오차드요양병원,101 104 301 307 308,"내과, 외과, 한방내과, 사상체질과, 침구과"
1158,5150000,054-832-2036,경상북도 의성군 봉양면 도리원2길 41,의료법인제중원 제남병원,101 104 110 111 103,"내과, 정신건강의학과, 외과, 산부인과, 소아청소년과"
1159,5150000,054-861-9111,경상북도 의성군 안계면 용기4길 36,의료법인영제의료재단 영남제일병원,105 101 104 301 307 308,"내과, 외과, 정형외과, 한방내과, 사상체질과, 침구과"
1160,5150000,054-834-1048,경상북도 의성군 금성면 탑리길 8-2,의료법인염광의료재단 성심요양병원,308 120 111 109 105 104 101,"내과, 외과, 정형외과, 마취통증의학과, 소아청소년과, 재활의학과, 침구과"
1161,5150000,054-861-3388,경상북도 의성군 안계면 안계길 200,의료법인성제의료재단 성제요양병원,101 104.301,내과
1162,5150000,054)834-6660,경상북도 의성군 의성읍 경북대로 5732,의료법인 해안의료재단 해안1병원,122 103,"정신건강의학과, 가정의학과"
1163,5150000,054-834-7400,경상북도 의성군 의성읍 안평의성로 1122-30,의성군공립요양병원,308 307 301 122 120 104 102 101,"내과, 신경과, 외과, 재활의학과, 가정의학과, 한방내과, 사상체질과, 침구과"
1164,5150000,054-832-7575,경상북도 의성군 의성읍 홍술로 94,의성제일요양병원,308 307 303 301 122 104,"외과, 가정의학과, 한방내과, 한방소아과, 사상체질과, 침구과"
1165,5110000,054-532-5001,경상북도 상주시 냉림서성길 7 (냉림동),의료법인삼백의료재단상주성모병원,109 101 104 111 110 105 102 116 106 113 119 115 108 122 120 107,"내과, 신경과, 외과, 정형외과, 신경외과, 흉부외과, 성형외과, 마취통증의학과, 산부인과, 소아청소년과, 이비인후과, 비뇨의학과, 영상의학과, 진단검사의학과, 재활의학과, 가정의학과"
1166,5110000,054-534-3501,경상북도 상주시 상서문로 53 (남성동),상주적십자병원,125 122 119 116 115 113 111 110 109 108 105 104 102 101,"내과, 신경과, 외과, 정형외과, 성형외과, 마취통증의학과, 산부인과, 소아청소년과, 이비인후과, 비뇨의학과, 영상의학과, 진단검사의학과, 가정의학과, 응급의학과"
1167,5110000,530-9000,경상북도 상주시 내서면 영남제일로 3659,의료법인 심천의료재단 상주제일병원,103,정신건강의학과
1168,5110000,530-5300,경상북도 상주시 용마로 190-45 (도남동),상주시립요양병원,308 107 106 104 101,"내과, 외과, 신경외과, 흉부외과, 침구과"
1169,5110000,054-536-5588,경상북도 상주시 낙동면 영남제일로 841,의료법인 우석의료재단 연세요양병원,101 122 104 301 308 302,"내과, 외과, 가정의학과, 한방내과, 한방부인과, 침구과"
1170,5110000,054-531-0005,경상북도 상주시 삼백로 66 (무양동),올바른요양병원,301 120,"재활의학과, 한방내과"
1171,5180000,054-734-9119,경상북도 영덕군 영덕읍 영덕로 72-12,의료법인 영덕의료재단 영덕효요양병원,308 307 305 122 106 105 104 101,"내과, 외과, 정형외과, 신경외과, 가정의학과, 한방신경정신과, 사상체질과, 침구과"
1172,5180000,054-730-0152,경상북도 영덕군 영해면 영덕로 1621,영덕아산병원,116 114 106 101,"내과, 신경외과, 피부과, 영상의학과"
1173,5200000,054-955-2661,경상북도 고령군 대가야읍 중앙로 33 (영생병원),의료법인 영암의료재단 고령영생병원,104 102 101,"내과, 신경과, 외과"
1174,5200000,054-956-8700,경상북도 고령군 대가야읍 중앙로 31 (군립노인복지병원),고령군립요양병원,301 109 101,"내과, 마취통증의학과, 한방내과"
1175,5230000,054-655-8000,경상북도 예천군 예천읍 원고개길 49,의료법인인덕의료재단 경도요양병원,308 301 122 120 111 104 102 101,"내과, 신경과, 외과, 소아청소년과, 재활의학과, 가정의학과, 한방내과, 침구과"
1176,5230000,054-655-6688,경상북도 예천군 예천읍 충효로 408-27,의료법인벽산의료재단 경희요양병원,101 104 301 308,"내과, 외과, 한방내과, 침구과"
1177,5090000,633-1131,경상북도 영주시 대동로31번길 9 (가흥동),영주자인병원,122 116 109 105 102 101,"내과, 신경과, 정형외과, 마취통증의학과, 영상의학과, 가정의학과"
1178,5090000,054-639-8888,경상북도 영주시 반지미로 265 (가흥동),의료법인영주의료재단명품요양병원,101 104 301 120 122,"내과, 외과, 재활의학과, 가정의학과, 한방내과"
1179,5090000,054-630-0100,"경상북도 영주시 대학로 327-0 (가흥동,영주적십자병원)",영주적십자병원,,
1180,5090000,639-9000,경상북도 영주시 구성로 329 (영주동),의료법인청봉의료재단성누가병원,125 122 116 111 109 106 105 104 101,"내과, 외과, 정형외과, 신경외과, 마취통증의학과, 소아청소년과, 영상의학과, 가정의학과, 응급의학과"
1181,5090000,635-6161,경상북도 영주시 구성로 380 (영주동),영주기독병원,101 104 105,"내과, 외과, 정형외과"
1182,5090000,634-3007,경상북도 영주시 지천로 164 (가흥동),의료법인일맥의료재단영주인애가한방병원,308 305 304 303 302 301 101,"내과, 한방내과, 한방부인과, 한방소아과, 한방안·이비인후·피부과, 한방신경정신과, 침구과"
1183,5090000,639-8856,경상북도 영주시 반지미로 275-17 (가흥동),(의)태훈의료재단 새희망병원,103,정신건강의학과
1184,5090000,054-639-8100,"경상북도 영주시 번영로 176, 영주가톨릭병원 (영주동)",영주가톨릭병원,122 116 111 109 106 105 101,"내과, 정형외과, 신경외과, 마취통증의학과, 소아청소년과, 영상의학과, 가정의학과"
1185,5090000,631-1500,"경상북도 영주시 안정면 장안로 697, 시립노인전문요양병원",영주시립노인전문요양병원,308 122 106 104 101,"내과, 외과, 신경외과, 가정의학과, 침구과"
1186,5090000,054-634-7600,경상북도 영주시 꽃동산로 43 (가흥동),영주삼봉병원,103,정신건강의학과
1187,5090000,054-630-9900,경상북도 영주시 신재로24번길 91 (가흥동),의)기호의료재단 청하요양병원,301 406 120 106 105 104 101,"내과, 외과, 정형외과, 신경외과, 재활의학과, 한방내과, 치주과"
1188,5080000,054-440-1004,경상북도 구미시 야은로 37 (부곡동),구미시립노인요양병원,308 301 122 120 104 101,"내과, 외과, 재활의학과, 가정의학과, 한방내과, 침구과"
1189,5080000,054-458-9300,경상북도 구미시 금오시장로2길 21 (원평동),강남병원,101 104 116 122 105 106 109,"내과, 외과, 정형외과, 신경외과, 마취통증의학과, 영상의학과, 가정의학과"
1190,5080000,054-475-2804,경상북도 구미시 인동가산로 14 (진평동),의료법인여연의료재단인동엘리트치과병원,408 407 406 404 403 402,"구강악안면외과, 치과보철과, 치과교정과, 치주과, 치과보존과, 구강내과"
1191,5080000,054-710-6000,경상북도 구미시 3공단1로 280-3 (임수동),의료법인 갑을의료재단 갑을구미병원,122 120 116 106 105 104 101,"내과, 외과, 정형외과, 신경외과, 영상의학과, 재활의학과, 가정의학과"
1192,5080000,054-455-8883,경상북도 구미시 야은로 483 (도량동),구미가톨릭요양병원,308 110 104 101,"내과, 외과, 산부인과, 침구과"
1193,5080000,054-442-0046,경상북도 구미시 여헌로 30 (인의동),미래로병원,103,정신건강의학과
1194,5080000,054-713-1000,"경상북도 구미시 산업로 168-8, 1,2,3,6,7층 (원평동)",큰사랑요양병원,301 122 120 104 102 101,"내과, 신경과, 외과, 재활의학과, 가정의학과, 한방내과"
1195,5080000,451-5000,경상북도 구미시 고아읍 이례로  46,의료법인이수의료재단구미천사요양병원,301 122 110,"산부인과, 가정의학과, 한방내과"
1196,5210000,054-932-1212,경상북도 성주군 성주읍 성주읍3길 5-3,성주무강병원,122 120 119 116 109 105 104 101,"내과, 외과, 정형외과, 마취통증의학과, 영상의학과, 진단검사의학과, 재활의학과, 가정의학과"
1197,5210000,054-933-5111,경상북도 성주군 성주읍 성주순환로 239,성주효요양병원,308 301 122 120 113 111 104 102 101,"내과, 신경과, 외과, 소아청소년과, 이비인후과, 재활의학과, 가정의학과, 한방내과, 침구과"
1198,5210000,054-932-7001,경상북도 성주군 성주읍 주산로 183,가야e요양병원,101 122,"내과, 가정의학과"
1199,5210000,933-0712,경상북도 성주군 성주읍 성주순환로 274,성주제일병원,122 111 103 101,"내과, 정신건강의학과, 소아청소년과, 가정의학과"
1200,5210000,054-933-0201,경상북도 성주군 선남면 도성3길 39-20,대경효의료소비자생활협동조합 대경요양병원,301 122 105 104 101,"내과, 외과, 정형외과, 가정의학과, 한방내과"
1201,5210000,054-982-9988,경상북도 성주군 선남면 운용로 1543-107,비에스(BS)요양병원,301 107 101,"내과, 흉부외과, 한방내과"
1202,5210000,054-933-5800,경상북도 성주군 성주읍 주산로 81,성주경대요양병원,301 122 112 101,"내과, 안과, 가정의학과, 한방내과"
1203,5160000,054-874-7717,"경상북도 청송군 진보면 경동로 4003, 진보병원",진보병원,101 103 104 122,"내과, 정신건강의학과, 외과, 가정의학과"
1204,5080000,054-463-7151,경상북도 구미시 1공단로 179 (공단동),순천향대학교 부속 구미병원,407 125 122 120 119 118 116 115 114 113 112 111 110 109 108 107 106 105 104 103 102 101,"내과, 신경과, 정신건강의학과, 외과, 정형외과, 신경외과, 흉부외과, 성형외과, 마취통증의학과, 산부인과, 소아청소년과, 안과, 이비인후과, 피부과, 비뇨의학과, 영상의학과, 병리과, 진단검사의학과, 재활의학과, 가정의학과, 응급의학과, 치과보존과"
1205,5080000,054-450-9700,경상북도 구미시 신시로10길 12 (형곡동),차의과학대학교부속구미차병원,125 124 122 120 119 118 116 115 114 113 112 111 110 109 108 107 106 105 104 103 102 101,"내과, 신경과, 정신건강의학과, 외과, 정형외과, 신경외과, 흉부외과, 성형외과, 마취통증의학과, 산부인과, 소아청소년과, 안과, 이비인후과, 피부과, 비뇨의학과, 영상의학과, 병리과, 진단검사의학과, 재활의학과, 가정의학과, 직업환경의학과, 응급의학과"
1206,5080000,054-458-5577,경상북도 구미시 송정대로 78 (송정동),참조은요양병원,308 307 302 301 122 105 104 101,"내과, 외과, 정형외과, 가정의학과, 한방내과, 한방부인과, 사상체질과, 침구과"
1207,5080000,054-471-2885,"경상북도 구미시 인동36길 17, 3층 (구평동, 보람빌딩)",가이드치과병원,406 405 404,"치과교정과, 소아치과, 치주과"
1208,5080000,054-476-7928,"경상북도 구미시 인동가산로 28, 4층 (진평동)",구미예치과병원,408,구강내과
1209,5080000,054-451-7500,경상북도 구미시 신시로 60 (형곡동),구미현대병원,105 109,"정형외과, 마취통증의학과"
1210,5080000,054-450-4500,경상북도 구미시 선기로 155-23 (선기동),의료법인한백의료재단 구미아성요양병원,308 307 301 122 110 106 104 101,"내과, 외과, 신경외과, 산부인과, 가정의학과, 한방내과, 사상체질과, 침구과"
1211,5080000,054-453-7575,경상북도 구미시 인동20길 46 (진평동),구미강동병원,401 126 125 124 122 119 116 113 111 110 109 108 106 105 104 102 101,"내과, 신경과, 외과, 정형외과, 신경외과, 성형외과, 마취통증의학과, 산부인과, 소아청소년과, 이비인후과, 영상의학과, 진단검사의학과, 가정의학과, 직업환경의학과, 응급의학과, 예방의학과, 치과"
1212,3540000,032-515-2325,"인천광역시 부평구 경원대로 1242, 지하1(일부)층, 1(일부)층, 3층, 4(일부)층, 5층, 6층, 7(일부)층 우암빌딩 (산곡동)",다인이비인후과병원,101 113,"내과, 이비인후과"
1213,3540000,032-521-5555,"인천광역시 부평구 장제로 175, 지하1(일부)층, 1(일부)층, 2층~8층 전체 (부평동)",재단법인 자연재단 더필잎요양병원,308 307 306 301 122 120 110 102 101,"내과, 신경과, 산부인과, 재활의학과, 가정의학과, 한방내과, 한방재활의학과, 사상체질과, 침구과"
1214,3540000,032-523-7771,인천광역시 부평구 장제로 129 (부평동),올리브요양병원,101 104 105 106 120 122,"내과, 외과, 정형외과, 신경외과, 재활의학과, 가정의학과"
1215,3540000,032-507-3355,"인천광역시 부평구 마장로 246, 새올 요양병원 (산곡동)",새올요양병원,101 102 103 111 120 122 301 302 303 304 305 306 307 308 309,"내과, 신경과, 정신건강의학과, 소아청소년과, 재활의학과, 가정의학과, 한방내과, 한방부인과, 한방소아과, 한방안·이비인후·피부과, 한방신경정신과, 한방재활의학과, 사상체질과, 침구과, 한방응급과"
1216,3540000,032-523-8275,"인천광역시 부평구 부흥로 283, 2층 (부평동, 힐링한방병원)",힐링한방병원,301 304 307 302 305 308 303 306,"한방내과, 한방부인과, 한방소아과, 한방안·이비인후·피부과, 한방신경정신과, 한방재활의학과, 사상체질과, 침구과"
1217,3540000,032-500-0114,인천광역시 부평구 무네미로 446 (구산동),근로복지공단인천병원,403 125 124 120 119 116 115 111 110 109 106 105 104 103 102 101,"내과, 신경과, 정신건강의학과, 외과, 정형외과, 신경외과, 마취통증의학과, 산부인과, 소아청소년과, 비뇨의학과, 영상의학과, 진단검사의학과, 재활의학과, 직업환경의학과, 응급의학과, 치과보철과"
1218,5070000,054-851-5000,경상북도 안동시 풍산읍 함백이길 154,의료법인 인덕의료재단 복주요양병원,301 122 120 104 103 102 101,"내과, 신경과, 정신건강의학과, 외과, 재활의학과, 가정의학과, 한방내과"
1219,3490000,032-770-1331,"인천광역시 중구 큰우물로 21 (용동, 지하1층, 1층, 3~5층, 8층)",가천대부속 동인천길병원,101 116 122,"내과, 영상의학과, 가정의학과"
1220,3490000,032-715-5933,인천광역시 중구 연안부두로21번길 11-12 (항동7가),고은요양병원,306 120 114 106 105 104 101,"내과, 외과, 정형외과, 신경외과, 피부과, 재활의학과, 한방재활의학과"
1221,3490000,032-270-8000,인천광역시 중구 답동로30번길 10 (율목동),인천기독병원,403 125 124 119 116 115 113 111 110 109 106 105 104 103 101,"내과, 정신건강의학과, 외과, 정형외과, 신경외과, 마취통증의학과, 산부인과, 소아청소년과, 이비인후과, 비뇨의학과, 영상의학과, 진단검사의학과, 직업환경의학과, 응급의학과, 치과보철과"
1222,3490000,032-890-2114,인천광역시 중구 인항로 27 (신흥동3가),인하대학교의과대학부속병원,407 404 403 402 125 124 123 122 120 119 118 117 116 115 114 113 112 111 110 109 108 107 106 105 104 103 102 101,"내과, 신경과, 정신건강의학과, 외과, 정형외과, 신경외과, 흉부외과, 성형외과, 마취통증의학과, 산부인과, 소아청소년과, 안과, 이비인후과, 피부과, 비뇨의학과, 영상의학과, 방사선종양학과, 병리과, 진단검사의학과, 재활의학과, 가정의학과, 핵의학과, 직업환경의학과, 응급의학과, 구강악안면외과, 치과보철과, 치과교정과, 치과보존과"
1223,3490000,032-773-6035,인천광역시 중구 개항로 82 (경동),예지요양병원,301 106 101,"내과, 신경외과, 한방내과"
1224,3490000,032-746-8100,"인천광역시 중구 영종대로 106, 지하1층(일부), 5~6층, 8~10층 (운서동)",힐락암요양병원,301 120 115 105 104 101,"내과, 외과, 정형외과, 비뇨의학과, 재활의학과, 한방내과"
1225,3490000,032-721-7575,"인천광역시 중구 우현로62번길 30 (경동, 지하1층, 1층, 2층, 3층)",인천삼성요양병원,308 301 122 120 107 104 101,"내과, 외과, 흉부외과, 재활의학과, 가정의학과, 한방내과, 침구과"
1226,3490000,032-770-1300,"인천광역시 중구 큰우물로 21 (용동, 가천대학교부속 길한방병원 본관 2층, 6층,7층, 9층,10층 )",가천대학교부속 길한방병원,308 307 306 305 304 303 302 301 101,"내과, 한방내과, 한방부인과, 한방소아과, 한방안·이비인후·피부과, 한방신경정신과, 한방재활의학과, 사상체질과, 침구과"
1227,3820000,031-827-2575,"경기도 의정부시 동일로 713, 을지타워 4층 (금오동)",의정부 모커리한방병원,308 307 306 305 304 303 302 301 120,"재활의학과, 한방내과, 한방부인과, 한방소아과, 한방안·이비인후·피부과, 한방신경정신과, 한방재활의학과, 사상체질과, 침구과"
1228,4700000,625-8996,전라북도 남원시  향단로  28,한빛요양병원,308 301 122 110 109,"마취통증의학과, 산부인과, 가정의학과, 한방내과, 침구과"
1229,4700000,636-7777,"전라북도 남원시 산곡길 55 (산곡동, 다사랑요양병원)",의료법인원산의료재단 다사랑요양병원,308 122 104,"외과, 가정의학과, 침구과"
1230,4700000,063620-1114,"전라북도 남원시 충정로 365 (고죽동,(고죽동))",전라북도 남원의료원,,
1231,6510000,064-796-0069,제주특별자치도 제주시 한림읍 한수풀로 58,의료법인평촌의료재단 제주대림요양병원,301 122,"가정의학과, 한방내과"
1232,6510000,064-1899-6265,제주특별자치도 제주시 중앙로 373 (이도이동),제주우리병원,122 116 109 106 105,"정형외과, 신경외과, 마취통증의학과, 영상의학과, 가정의학과"
1233,6510000,064-786-7000,제주특별자치도 제주시 월랑로 91 (이호이동),의료법인 중앙의료재단 중앙병원,101 104 106 105 108 111 110 116 109 119 103 102 113 115 112 120 122 125 107 401,"내과, 신경과, 정신건강의학과, 외과, 정형외과, 신경외과, 흉부외과, 성형외과, 마취통증의학과, 산부인과, 소아청소년과, 안과, 이비인후과, 비뇨의학과, 영상의학과, 진단검사의학과, 재활의학과, 가정의학과, 응급의학과, 치과"
1234,5350000,559006600,"경상남도 김해시 율하3로 29, 4,5,6층 (율하동)",경희리틀병원,111,소아청소년과
1235,3630000,062-433-8275,"광주광역시 광산구 상무대로 306, 하나병원 (송정동)",참사랑한방병원,308 307 306 305 304 303 302 301 122,"가정의학과, 한방내과, 한방부인과, 한방소아과, 한방안·이비인후·피부과, 한방신경정신과, 한방재활의학과, 사상체질과, 침구과"
1236,3520000,032-421-1288,"인천광역시 연수구 벚꽃로 114, 브랫슬 7~8층 (연수동)",로하스인천요양병원,101 102 103 104 105 106 107 109 113 114 115 116 119 120 122 301 302 306 308,"내과, 신경과, 정신건강의학과, 외과, 정형외과, 신경외과, 흉부외과, 마취통증의학과, 이비인후과, 피부과, 비뇨의학과, 영상의학과, 진단검사의학과, 재활의학과, 가정의학과, 한방내과, 한방부인과, 한방재활의학과, 침구과"
1237,3600000,062-413-1100,"광주광역시 서구 상무대로 874, 2,5,6,7층 (쌍촌동)",운천한방병원,308 307 306 305 304 303 302 301 122,"가정의학과, 한방내과, 한방부인과, 한방소아과, 한방안·이비인후·피부과, 한방신경정신과, 한방재활의학과, 사상체질과, 침구과"
1238,3470000,053-563-1000,대구광역시 달서구 달구벌대로 1576 (감삼동),더나은병원,120 116 106 102 101,"내과, 신경과, 신경외과, 영상의학과, 재활의학과"
1239,3830000,031-688-7114,"경기도 안양시 만안구 병목안로 20, 스페이스타워 5 ~10층 (안양동)",안양서울 대효요양병원,308 306 301 120 104 102,"신경과, 외과, 재활의학과, 한방내과, 한방재활의학과, 침구과"
1240,3030000,1522-7586,서울특별시 성동구 동일로 133 (성수동2가),연세바로척병원,120 116 109 106 105 101,"내과, 정형외과, 신경외과, 마취통증의학과, 영상의학과, 재활의학과"
1241,3470000,053-526-5991,"대구광역시 달서구 용산로 141, 그랜드M 타워 지하2,지상2,10,11,15층동 (용산동)",신홍도요양병원,308 301 122 120 118 116 106 105 104 102 101,"내과, 신경과, 외과, 정형외과, 신경외과, 영상의학과, 병리과, 재활의학과, 가정의학과, 한방내과, 침구과"
1242,3270000,051-715-1144,부산광역시 동구 범일로 112 (범일동),더힐러스병원,103 102,"신경과, 정신건강의학과"
1243,4090000,031-989-7587,"경기도 김포시 김포한강10로133번길 67, 지1-2층 (구래동)",김포다올요양병원,308 306 305 304 303 302 301 122 120 105 104 102 101,"내과, 신경과, 외과, 정형외과, 재활의학과, 가정의학과, 한방내과, 한방부인과, 한방소아과, 한방안·이비인후·피부과, 한방신경정신과, 한방재활의학과, 침구과"
1244,3610000,062-710-1199,광주광역시 남구 금화로 436 (월산동),화이트병원,308 304 302 301 115 114 113 110 104 101,"내과, 외과, 산부인과, 이비인후과, 피부과, 비뇨의학과, 한방내과, 한방부인과, 한방안·이비인후·피부과, 침구과"
1245,3780000,031-722-1175,"경기도 성남시 수정구 성남대로 1170, 의남빌딩 7층 일부,8층 (수진동)",성신한방병원,308 307 306 305 304 303 302 301,"한방내과, 한방부인과, 한방소아과, 한방안·이비인후·피부과, 한방신경정신과, 한방재활의학과, 사상체질과, 침구과"
1246,3340000,051-715-4242,부산광역시 사하구 다대로 251 (장림동),항스퀘어 병원,104 101,"내과, 외과"
1247,3940000,031-782-8300,"경기도 고양시 일산동구 중앙로 1205, 지하1층(일부),지하2층,지하4층(일부),1층(일부),3층(일부),4~5층,6층(일부),7~10층 (장항동)",의료법인성광의료재단일산차병원,301 123 122 120 119 118 117 116 115 114 111 110 109 108 104 103 102 101,"내과, 신경과, 정신건강의학과, 외과, 성형외과, 마취통증의학과, 산부인과, 소아청소년과, 피부과, 비뇨의학과, 영상의학과, 방사선종양학과, 병리과, 진단검사의학과, 재활의학과, 가정의학과, 핵의학과, 한방내과"
1248,4090000,1833-8371,"경기도 김포시 김포한강4로 543, 지오프라자 3,4층 (구래동)",연세더바른병원,116 109 106 105 101,"내과, 정형외과, 신경외과, 마취통증의학과, 영상의학과"
1249,3610000,062-675-1111,"광주광역시 남구 봉선1로 114, 2~6층, 지하1층 (봉선동)",무등요양병원,122 301 308,"가정의학과, 한방내과, 침구과"
1250,3430000,053-262-2626,"대구광역시 서구 국채보상로 223, 대원빌딩 5~10층 (평리동)",경대재활요양병원,301 126 122 120 104 102 101,"내과, 신경과, 외과, 재활의학과, 가정의학과, 예방의학과, 한방내과"
1251,3910000,031-655-5200,"경기도 평택시 비전5로 20-30, 2,3,4,5층 (비전동)",도솔한방병원,308 307 306 305 304 303 302 301 122 120 116,"영상의학과, 재활의학과, 가정의학과, 한방내과, 한방부인과, 한방소아과, 한방안·이비인후·피부과, 한방신경정신과, 한방재활의학과, 사상체질과, 침구과"
1252,3720000,052-221-2875,"울산광역시 북구 매산4로 17, 1~3층 (신천동)",큰치과병원,412 411 409 408 407 406 405 404 403 402,"구강악안면외과, 치과보철과, 치과교정과, 소아치과, 치주과, 치과보존과, 구강내과, 영상치의학과, 예방치과, 통합치의학과"
1253,3510500,032-887-2500,"인천광역시 미추홀구 인중로 5, 정산빌딩 지하1,지상2~10층 (숭의동)",꿈이있는요양병원,308 307 306 301 122 120 115 114 113 110 106 105 104 102 101,"내과, 신경과, 외과, 정형외과, 신경외과, 산부인과, 이비인후과, 피부과, 비뇨의학과, 재활의학과, 가정의학과, 한방내과, 한방재활의학과, 사상체질과, 침구과"
1254,5180000,054733-1771,경상북도 영덕군 영덕읍 우곡길 52-0,영덕제일요양병원,,
1255,3080000,29879988,서울특별시 강북구 월계로 183 (번동),꿈의숲요양병원,308 122 120 106 105 104 102 101,"내과, 신경과, 외과, 정형외과, 신경외과, 재활의학과, 가정의학과, 침구과"
1256,3300000,1522-4854,"부산광역시 동래구 아시아드대로 261, 지하1~지상6층 (온천동)",새힘병원,122 114 111 102 101,"내과, 신경과, 소아청소년과, 피부과, 가정의학과"
