번호,개방자치단체코드,소재지전화,주소,사업장명,진료과목내용,진료과목내용명
3360,5670000,055-246-3131,"경상남도 창원시 마산합포구 3·15대로 164, 메디칼빌딩 (중앙동2가)",삼일정풍병원,101 102 116 120 122 301 302 303 304 305 306 307 308,"내과, 신경과, 영상의학과, 재활의학과, 가정의학과, 한방내과, 한방부인과, 한방소아과, 한방안·이비인후·피부과, 한방신경정신과, 한방재활의학과, 사상체질과, 침구과"
3361,5670000,055-248-0365,경상남도 창원시 마산회원구 3·15대로 686 (석전동),365병원,101 105 106 109 116,"내과, 정형외과, 신경외과, 마취통증의학과, 영상의학과"
3362,5670000,055-256-0007,"경상남도 창원시 마산회원구 양덕로 194 (석전동, 영광약국)",라온치과병원,411 410 409 408 407 406 405 404 403 402,"구강악안면외과, 치과보철과, 치과교정과, 소아치과, 치주과, 치과보존과, 구강내과, 영상치의학과, 구강병리과, 예방치과"
3363,5670000,055-551-2828,"경상남도 창원시 진해구 진해대로776번길 27, 5층 (이동, 온메디칼빌딩)",온치과병원,408 407 404 403 401,"치과, 치과보철과, 치과교정과, 치과보존과, 구강내과"
3364,5670000,055-547-3100,경상남도 창원시 진해구 남의로 150 (두동),용원휴요양병원,101 104 106 102 301 105 120 122,"내과, 신경과, 외과, 정형외과, 신경외과, 재활의학과, 가정의학과, 한방내과"
3365,5670000,055-222-9161,"경상남도 창원시 마산합포구 해안대로 331 (남성동, 한백웨딩프라자)",은혜병원,401 122 120 116 104 101,"내과, 외과, 영상의학과, 재활의학과, 가정의학과, 치과"
3366,5670000,055-290-2900,"경상남도 창원시 마산회원구 양덕로 190 (석전동, 바른몸빌딩)",베스트수병원,122 120 118 116 113 111 109 107 106 105 104 101,"내과, 외과, 정형외과, 신경외과, 흉부외과, 마취통증의학과, 소아청소년과, 이비인후과, 영상의학과, 병리과, 재활의학과, 가정의학과"
3367,5670000,055-543-7500,경상남도 창원시 진해구 충장로 181 (여좌동),늘푸른요양병원,101 104 122 301 302 305 308 306 307,"내과, 외과, 가정의학과, 한방내과, 한방부인과, 한방신경정신과, 한방재활의학과, 사상체질과, 침구과"
3368,5670000,055-545-0500,"경상남도 창원시 진해구 행암로 12, 엠에스빌딩 5,6층 (장천동)",진해성모병원,116 114 113 111 108 105 101,"내과, 정형외과, 성형외과, 소아청소년과, 이비인후과, 피부과, 영상의학과"
3369,5670000,055-800-8875,"경상남도 창원시 의창구 용동로 45, 현대썬앤빌 더 스퀘어 A동 5-6층 (사림동)",예이재한방병원,308 307 306 305 304 303 302 301 122 106 105 101,"내과, 정형외과, 신경외과, 가정의학과, 한방내과, 한방부인과, 한방소아과, 한방안·이비인후·피부과, 한방신경정신과, 한방재활의학과, 사상체질과, 침구과"
3370,5670000,055-286-3377,"경상남도 창원시 성산구 마디미서로 26, 한독빌딩 8층,9층,10층 1003호 (상남동)",라라한방병원,114 307 122 105 106 301 101 303 302 120 306 308 305 109 304,"내과, 정형외과, 신경외과, 마취통증의학과, 피부과, 재활의학과, 가정의학과, 한방내과, 한방부인과, 한방소아과, 한방안·이비인후·피부과, 한방신경정신과, 한방재활의학과, 사상체질과, 침구과"
3371,5670000,055-270-2500,"경상남도 창원시 성산구 원이대로393번길 25, 케이프타운 4-5층 일부, 6층 지하1-2층 일부호 (반지동)",희연병원,122 120 101,"내과, 재활의학과, 가정의학과"
3372,5670000,055-221-0365,"경상남도 창원시 마산회원구 3·15대로 686, 365병원 본관동 5,7,8,10층 501,701,801,1003호 (석전동)",강추한방병원,308 307 306 305 304 303 302 301 122 120 114 109 106 105 101,"내과, 정형외과, 신경외과, 마취통증의학과, 피부과, 재활의학과, 가정의학과, 한방내과, 한방부인과, 한방소아과, 한방안·이비인후·피부과, 한방신경정신과, 한방재활의학과, 사상체질과, 침구과"
3373,5670000,055-541-0600,"경상남도 창원시 진해구 진해대로 752, 아리온시네마빌딩 3층 304,309호 (석동)",창원진해연세스위트치과병원,411 410 409 408 407 406 405 404 403 402,"구강악안면외과, 치과보철과, 치과교정과, 소아치과, 치주과, 치과보존과, 구강내과, 영상치의학과, 구강병리과, 예방치과"
3374,5670000,055-251-0888,"경상남도 창원시 의창구 평산로 96, 웰빙프라자 4-5층 (팔용동)",의료법인승현의료재단 심산서울병원,308 301 122 110 101,"내과, 산부인과, 가정의학과, 한방내과, 침구과"
3375,5670000,055-245-9988,"경상남도 창원시 마산합포구 3·15대로 243, 7~11층 (중앙동3가)",경희요양병원,308 307 306 301 122 120 115 114 106 105 104 102 101,"내과, 신경과, 외과, 정형외과, 신경외과, 피부과, 비뇨의학과, 재활의학과, 가정의학과, 한방내과, 한방재활의학과, 사상체질과, 침구과"
3376,5670000,055-712-7000,"경상남도 창원시 성산구 원이대로682번길 8, SH빌딩 (상남동)",창원자생한방병원,101 116 303 306 302 305 308 301 304 307,"내과, 영상의학과, 한방내과, 한방부인과, 한방소아과, 한방안·이비인후·피부과, 한방신경정신과, 한방재활의학과, 사상체질과, 침구과"
3377,5670000,055-551-0002,"경상남도 창원시 진해구 용원로 13, 2,3,5층 (용원동)",우리병원,308 307 306 305 304 303 302 301 114 111 101,"내과, 소아청소년과, 피부과, 한방내과, 한방부인과, 한방소아과, 한방안·이비인후·피부과, 한방신경정신과, 한방재활의학과, 사상체질과, 침구과"
3378,5670000,055-240-8200,"경상남도 창원시 마산합포구 남성로 167 (동성동, 한마빌딩)",광제요양병원,308 307 301 105 104 101,"내과, 외과, 정형외과, 한방내과, 사상체질과, 침구과"
3379,5670000,055-230-7777,경상남도 창원시 마산합포구 가포로 652 (덕동동),의료법인성인의료재단이에이씨창원요양병원,408 407 406 403 402 308 122 120 105 103 101,"내과, 정신건강의학과, 정형외과, 재활의학과, 가정의학과, 침구과, 구강악안면외과, 치과보철과, 치주과, 치과보존과, 구강내과"
3380,5670000,055-232-5600,경상남도 창원시 마산회원구 내서읍 죽암로 89 (신세계요양병원),의료법인청록의료재단신세계요양병원,308 307 306 305 304 303 302 301 122 120 101,"내과, 재활의학과, 가정의학과, 한방내과, 한방부인과, 한방소아과, 한방안·이비인후·피부과, 한방신경정신과, 한방재활의학과, 사상체질과, 침구과"
3381,5670000,552495500,"경상남도 창원시 마산합포구 중앙서1길 25 (대성동2가, 예경노인병원)",의료법인예경의료재단예경요양병원,101 115 118 120 122 301,"내과, 비뇨의학과, 병리과, 재활의학과, 가정의학과, 한방내과"
3382,5670000,055-223-7847,"경상남도 창원시 마산합포구 문화동15길 25 (창포동3가, 롯데빌리지)",신마산서울아동병원,101 113 111 114,"내과, 소아청소년과, 이비인후과, 피부과"
3383,5670000,055-247-7277,경상남도 창원시 마산합포구 무학로 402 (자산동),의료법인영민의료재단소망노인전문병원,308 307 301 122 106,"신경외과, 가정의학과, 한방내과, 사상체질과, 침구과"
3384,5670000,055-547-1300,경상남도 창원시 진해구 진해대로 765 (석동),진해라온치과병원,401 207 201 202 203 205 206,"구강악안면외과, 치과보철과, 치과교정과, 치주과, 치과보존과, 구강내과, 치과"
3385,5670000,055-230-9138,경상남도 창원시 의창구 의창대로 45 (소계동),의료법인 상원의료재단 창원힘찬병원,101 105 106 109 116 119,"내과, 정형외과, 신경외과, 마취통증의학과, 영상의학과, 진단검사의학과"
3386,5670000,055-298-7582,경상남도 창원시 의창구 의안로2번길 31 (소답동),창원삼성요양병원,101 102 104 105 106 109 120 122 301 302 304 305 306 308,"내과, 신경과, 외과, 정형외과, 신경외과, 마취통증의학과, 재활의학과, 가정의학과, 한방내과, 한방부인과, 한방안·이비인후·피부과, 한방신경정신과, 한방재활의학과, 침구과"
3387,5670000,055-251-2221,경상남도 창원시 의창구 동읍 의창대로 882,의료법인 자은의료재단 덕산요양병원,308 303 302 301 122 111 106 105 104 101,"내과, 외과, 정형외과, 신경외과, 소아청소년과, 가정의학과, 한방내과, 한방부인과, 한방소아과, 침구과"
3388,5670000,552652800,경상남도 창원시 의창구 사화로 6 (팔용동),굿모닝내과병원,101 113 114 115 104 105 106 110 116 111 103 102 120 112,"내과, 신경과, 정신건강의학과, 외과, 정형외과, 신경외과, 산부인과, 소아청소년과, 안과, 이비인후과, 피부과, 비뇨의학과, 영상의학과, 재활의학과"
3389,5670000,055-262-9000,"경상남도 창원시 성산구 원이대로 578, 구트병원빌딩 6층,8-12층 (중앙동)",구트병원,104 101 114 115 111 113 105 109 116,"내과, 외과, 정형외과, 마취통증의학과, 소아청소년과, 이비인후과, 피부과, 비뇨의학과, 영상의학과"
3390,5670000,055-293-3311,경상남도 창원시 의창구 북면 천주로 1092,북면이화요양병원,101 104 111 122 105 308 301 120,"내과, 외과, 정형외과, 소아청소년과, 재활의학과, 가정의학과, 한방내과, 침구과"
3391,5670000,055-541-4500,경상남도 창원시 진해구 충장로 154 (충무동),참좋은요양병원,308 301 122 105,"정형외과, 가정의학과, 한방내과, 침구과"
3392,5670000,055-270-5500,경상남도 창원시 의창구 대봉로26번길 12-3 (봉림동),시티요양병원,308 307 306 305 301 122 120 115 109 106 105 104 102 101,"내과, 신경과, 외과, 정형외과, 신경외과, 마취통증의학과, 비뇨의학과, 재활의학과, 가정의학과, 한방내과, 한방신경정신과, 한방재활의학과, 사상체질과, 침구과"
3393,5670000,055-294-1400,"경상남도 창원시 의창구 남산로17번길 28, 2층, 3층 (팔용동, 팔용에이스빌딩 2,3층)",서라벌요양병원,101 102 104 106 120 122 301 302 303 304 305 306 307 308,"내과, 신경과, 외과, 신경외과, 재활의학과, 가정의학과, 한방내과, 한방부인과, 한방소아과, 한방안·이비인후·피부과, 한방신경정신과, 한방재활의학과, 사상체질과, 침구과"
3394,5670000,055-249-0600,"경상남도 창원시 마산합포구 불종거리로 19 (동성동, 참여성병원)",참여성병원,110 111,"산부인과, 소아청소년과"
3395,5670000,055-220-7777,경상남도 창원시 마산합포구 동서동2길 45 (신포동2가),의료법인위더스의료재단위더스병원,308 122 120 101,"내과, 재활의학과, 가정의학과, 침구과"
3396,5670000,055-719-0100,"경상남도 창원시 의창구 평산로 102, 녹주빌딩 2,3층 (팔용동)",유니한방병원,308 307 306 305 304 303 302 301 120 114 109 106 105 102 101,"내과, 신경과, 정형외과, 신경외과, 마취통증의학과, 피부과, 재활의학과, 한방내과, 한방부인과, 한방소아과, 한방안·이비인후·피부과, 한방신경정신과, 한방재활의학과, 사상체질과, 침구과"
3397,5670000,055-602-3119,"경상남도 창원시 의창구 용동로83번안길 3, 화사랑메디컬 3-5층 (사림동)",화사랑병원,122 115 114 111 109 108 104 101,"내과, 외과, 성형외과, 마취통증의학과, 소아청소년과, 피부과, 비뇨의학과, 가정의학과"
3398,5670000,055-253-6000,"경상남도 창원시 의창구 팔용로 319, 반계동 요양병원 A동 지하1~지상4층 (반계동)",예정요양병원,301 122 120 118 116 115 114 113 105 104 102 101,"내과, 신경과, 외과, 정형외과, 이비인후과, 피부과, 비뇨의학과, 영상의학과, 병리과, 재활의학과, 가정의학과, 한방내과"
3399,5670000,055-246-3300,"경상남도 창원시 마산합포구 오동동10길 73, 2-3층 (오동동, 서광아침의빛)",한마음요양병원,301 122 120 116 114 111 110 106 105 104 102 101,"내과, 신경과, 외과, 정형외과, 신경외과, 산부인과, 소아청소년과, 피부과, 영상의학과, 재활의학과, 가정의학과, 한방내과"
3400,5670000,055-291-7000,"경상남도 창원시 마산회원구 3·15대로 850, 복음요양병원 (합성동)",복음요양병원,307 306 305 304 303 302 301 122 120 119 116 115 114 113 105 104 102 101,"내과, 신경과, 외과, 정형외과, 이비인후과, 피부과, 비뇨의학과, 영상의학과, 진단검사의학과, 재활의학과, 가정의학과, 한방내과, 한방부인과, 한방소아과, 한방안·이비인후·피부과, 한방신경정신과, 한방재활의학과, 사상체질과"
3401,5670000,055-220-7500,"경상남도 창원시 마산합포구 해안대로 35 (해운동, MH우리병원)",의료법인합포의료재단마산우리요양병원,308 307 306 301 122 120 106 105 101,"내과, 정형외과, 신경외과, 재활의학과, 가정의학과, 한방내과, 한방재활의학과, 사상체질과, 침구과"
3402,5670000,055-299-7000,경상남도 창원시 마산회원구 3·15대로 653 (석전동),서울병원,122 116 109 106 105,"정형외과, 신경외과, 마취통증의학과, 영상의학과, 가정의학과"
3403,5670000,055-299-8275,경상남도 창원시 마산회원구 양덕로 190 (석전동),양덕서울아동병원,114 113 111 101,"내과, 소아청소년과, 이비인후과, 피부과"
3404,5670000,055-552-7582,"경상남도 창원시 진해구 용원로 15 (용원동, 희망병원)",희망병원,122 120 119 116 113 111 110 109 106 105 104 101,"내과, 외과, 정형외과, 신경외과, 마취통증의학과, 산부인과, 소아청소년과, 이비인후과, 영상의학과, 진단검사의학과, 재활의학과, 가정의학과"
3405,5670000,055-815-7575,"경상남도 창원시 진해구 충장로 172 (충무동, 진해수요양병원)",진해수요양병원,308 307 303 302 301 122 106 105 104 102 101,"내과, 신경과, 외과, 정형외과, 신경외과, 가정의학과, 한방내과, 한방부인과, 한방소아과, 사상체질과, 침구과"
3406,5670000,055-716-1114,경상남도 창원시 진해구 만금로 17 (용원동),용원중앙병원,105 101,"내과, 정형외과"
3407,5670000,055-214-2000,"경상남도 창원시 성산구 삼정자로 11 (성주동, 창원경상대학교병원)",창원경상국립대학교병원,101 102 103 104 105 106 107 108 109 110 111 112 113 114 115 116 117 118 119 120 123 124 125 402,"내과, 신경과, 정신건강의학과, 외과, 정형외과, 신경외과, 흉부외과, 성형외과, 마취통증의학과, 산부인과, 소아청소년과, 안과, 이비인후과, 피부과, 비뇨의학과, 영상의학과, 방사선종양학과, 병리과, 진단검사의학과, 재활의학과, 핵의학과, 직업환경의학과, 응급의학과, 구강악안면외과"
3408,5670000,055-291-2002,"경상남도 창원시 의창구 동읍 의창대로 870-5, 동창원요양병원 1,2,3,4층 지하1층(103호)호",의료법인승인의료재단동창원요양병원,308 307 306 304 303 302 301 122 120 106 105 104 102 101,"내과, 신경과, 외과, 정형외과, 신경외과, 재활의학과, 가정의학과, 한방내과, 한방부인과, 한방소아과, 한방안·이비인후·피부과, 한방재활의학과, 사상체질과, 침구과"
3409,5670000,055-298-1075,"경상남도 창원시 성산구 원이대로 674, 당당한방병원 지하1층, 3-8층 (상남동)",당당한방병원,308 307 306 305 304 303 302 301 122 110 105,"정형외과, 산부인과, 가정의학과, 한방내과, 한방부인과, 한방소아과, 한방안·이비인후·피부과, 한방신경정신과, 한방재활의학과, 사상체질과, 침구과"
3410,5670000,055-221-3388,경상남도 창원시 마산합포구 수산1길 262-2 (오동동),의료법인벽암의료재단 큰바다요양병원,308 307 306 305 304 302 301 122 106 105 104 102 101,"내과, 신경과, 외과, 정형외과, 신경외과, 가정의학과, 한방내과, 한방부인과, 한방안·이비인후·피부과, 한방신경정신과, 한방재활의학과, 사상체질과, 침구과"
3411,5670000,055-222-7900,"경상남도 창원시 마산합포구 현동로 38, 4-10층 (우산동)",친절요양병원,308 307 301 115 114 106 105 104 102 101,"내과, 신경과, 외과, 정형외과, 신경외과, 피부과, 비뇨의학과, 한방내과, 사상체질과, 침구과"
3412,5670000,055-606-7722,경상남도 창원시 마산합포구 진동면 삼진의거대로 826,의료법인혜주의료재단 더편한요양병원,308 301 122 109 106 105 104 102 101,"내과, 신경과, 외과, 정형외과, 신경외과, 마취통증의학과, 가정의학과, 한방내과, 침구과"
3413,5670000,055-715-2500,"경상남도 창원시 마산회원구 용마로 130, 메트로센텀 5,11층 (양덕동)",키즈웰소아청소년과병원,115 114 113 112 111 105 104 101,"내과, 외과, 정형외과, 소아청소년과, 안과, 이비인후과, 피부과, 비뇨의학과"
3414,5670000,055-552-0013,"경상남도 창원시 진해구 용원로 37 (용원동, 블루마운틴)",메트로요양병원,306 302 301 122 120 115 111 106 105 104 103 102 101,"내과, 신경과, 정신건강의학과, 외과, 정형외과, 신경외과, 소아청소년과, 비뇨의학과, 재활의학과, 가정의학과, 한방내과, 한방부인과, 한방재활의학과"
3415,5670000,055-221-2700,경상남도 창원시 마산합포구 현동로 15 (우산동),시립마산요양병원,308 307 306 305 304 303 302 301 122 120 102 101,"내과, 신경과, 재활의학과, 가정의학과, 한방내과, 한방부인과, 한방소아과, 한방안·이비인후·피부과, 한방신경정신과, 한방재활의학과, 사상체질과, 침구과"
3416,5670000,055-299-7510,"경상남도 창원시 마산회원구 3·15대로 775 (합성동, 합성메디칼센타)",미소안재활병원,101 120 106 115,"내과, 신경외과, 비뇨의학과, 재활의학과"
3417,5670000,055-542-9000,경상남도 창원시 진해구 진해대로 958 (자은동),예인여성병원,101 104 110 111 115 114 105 122 108 106 109 102 112 113 107,"내과, 신경과, 외과, 정형외과, 신경외과, 흉부외과, 성형외과, 마취통증의학과, 산부인과, 소아청소년과, 안과, 이비인후과, 피부과, 비뇨의학과, 가정의학과"
3418,5670000,055-540-3700,경상남도 창원시 진해구 중원동로 55-1 (중앙동),의료법인염광의료재단세광병원,120 116 111 109 106 105 101,"내과, 정형외과, 신경외과, 마취통증의학과, 소아청소년과, 영상의학과, 재활의학과"
3419,5670000,055-270-8888,"경상남도 창원시 성산구 창원천로94번길 82-18, 푸른요양병원 (대원동)",푸른요양병원,308 307 306 302 301 122 120 110 104 102 101,"내과, 신경과, 외과, 산부인과, 재활의학과, 가정의학과, 한방내과, 한방부인과, 한방재활의학과, 사상체질과, 침구과"
3420,5670000,055-253-3555,"경상남도 창원시 성산구 마디미서로 56 (상남동, 2,3,4,5,6,7,10층)",모란여성병원,110 111,"산부인과, 소아청소년과"
3421,5670000,055-270-0900,"경상남도 창원시 의창구 우곡로217번길 10 (명서동, 지하1,2층지상2,3,4,5,6,7,8층)",the큰병원,104 106 109 116 122,"외과, 신경외과, 마취통증의학과, 영상의학과, 가정의학과"
3422,5670000,055-713-9500,"경상남도 창원시 마산합포구 진동면 동전고개로 2, 진동태봉병원",의료법인우암의료재단진동태봉병원,122 115 114 113 106 105 104 101,"내과, 외과, 정형외과, 신경외과, 이비인후과, 피부과, 비뇨의학과, 가정의학과"
3423,5670000,055-600-8000,경상남도 창원시 마산회원구 북성로 469 (두척동),큰사랑요양병원,101 120 122 102 301 305 306 307 308,"내과, 신경과, 재활의학과, 가정의학과, 한방내과, 한방신경정신과, 한방재활의학과, 사상체질과, 침구과"
3424,5670000,055-540-7500,경상남도 창원시 진해구 용원서로 42 (용원동),의료법인 심연의료재단 세명병원,101 104 111 116 109 105 106 113 115 114,"내과, 외과, 정형외과, 신경외과, 마취통증의학과, 소아청소년과, 이비인후과, 피부과, 비뇨의학과, 영상의학과"
3425,4210000,033530-3100,"강원도 동해시 하평로 11-  (평릉동, (평릉동))",근로복지공단 동해병원,,
3426,4210000,033-532-3006,강원도 동해시 하평로 26 (평릉동),의료법인 동해동인병원,412 122 119 116 115 113 111 110 109 106 105 104 103 101,"내과, 정신건강의학과, 외과, 정형외과, 신경외과, 마취통증의학과, 산부인과, 소아청소년과, 이비인후과, 비뇨의학과, 영상의학과, 진단검사의학과, 가정의학과, 통합치의학과"
3427,4270000,033-370-9101,강원도 영월군 영월읍 중앙1로 59,강원도영월의료원,101 104 110 111 112 116 106 105 109 119 114 401,"내과, 외과, 정형외과, 신경외과, 마취통증의학과, 산부인과, 소아청소년과, 안과, 피부과, 영상의학과, 진단검사의학과, 치과"
3428,4270000,033-374-7575,강원도 영월군 영월읍 중앙로 10,푸른사랑병원,101 104 111 105 106 107 114 115 112 113 125 118 122 120 116,"내과, 외과, 정형외과, 신경외과, 흉부외과, 소아청소년과, 안과, 이비인후과, 피부과, 비뇨의학과, 영상의학과, 병리과, 재활의학과, 가정의학과, 응급의학과"
3429,4290000,033-560-7100,강원도 정선군 정선읍 봉양1길 145,근로복지공단정선병원,124 116 101,"내과, 영상의학과, 직업환경의학과"
3430,4290000,033-592-3121,"강원도 정선군 사북읍 지장천로 727, 재)정선의료재단 군립병원",재)정선의료재단 군립병원,111 105 104 101,"내과, 외과, 정형외과, 소아청소년과"
3431,4210000,033-533-8275,강원도 동해시 중앙로 210 (천곡동),한마음병원,116 109 106 105 101,"내과, 정형외과, 신경외과, 마취통증의학과, 영상의학과"
3432,4210000,033-533-7741,강원도 동해시 덕골길 76-40 (천곡동),동해이레요양병원,122 111 105,"정형외과, 소아청소년과, 가정의학과"
3433,4210000,033-520-7200,강원도 동해시 동해대로 5143 (효가동),동해금강요양병원,106,신경외과
3434,4210000,033-531-2500,"강원도 동해시 중앙로 218 (천곡동, 해람병원)",동해요양병원,406 301 120 102 101,"내과, 신경과, 재활의학과, 한방내과, 치주과"
3435,4230000,033-630-6000,강원도 속초시 영랑호반길 3 (영랑동),강원도속초의료원,401 125 122 120 119 116 115 113 111 110 109 108 106 105 104 103 102 101,"내과, 신경과, 정신건강의학과, 외과, 정형외과, 신경외과, 성형외과, 마취통증의학과, 산부인과, 소아청소년과, 이비인후과, 비뇨의학과, 영상의학과, 진단검사의학과, 재활의학과, 가정의학과, 응급의학과, 치과"
3436,4230000,033-639-8500,강원도 속초시 중앙로 11 (교동),의료법인보광의료재단속초보광병원,119 118 116 113 111 110 109 105 104 103 102 101,"내과, 신경과, 정신건강의학과, 외과, 정형외과, 마취통증의학과, 산부인과, 소아청소년과, 이비인후과, 영상의학과, 병리과, 진단검사의학과"
3437,4230000,033-637-0757,강원도 속초시 동해대로 4084 (조양동),속초정요양병원,107 104 101,"내과, 외과, 흉부외과"
3438,4230000,1877-7007,"강원도 속초시 동해대로 4236, 8층 (교동, 아남프라자)",위덴치과병원,412 411,"예방치과, 통합치의학과"
3439,4230000,033-638-0060,강원도 속초시 온천로 291-0 (교동),속초우리요양병원,301 122 110 106,"신경외과, 산부인과, 가정의학과, 한방내과"
3440,5480000,055-933-1006,"경상남도 합천군 대양면 대야로 737-20, 2호",합천고려병원,101 104 103 109 113 111 105 102,"내과, 신경과, 정신건강의학과, 외과, 정형외과, 마취통증의학과, 소아청소년과, 이비인후과"
3441,5480000,055-933-2200,경상남도 합천군 합천읍 대야로 876,삼성합천병원,122 116 111 110 109 108 105 102 101,"내과, 신경과, 정형외과, 성형외과, 마취통증의학과, 산부인과, 소아청소년과, 영상의학과, 가정의학과"
3442,5480000,055-933-3400,경상남도 합천군 합천읍 신소양2길 40,합천요양병원,308 307 306 305 303 302 301 122 105 102 101,"내과, 신경과, 정형외과, 가정의학과, 한방내과, 한방부인과, 한방소아과, 한방신경정신과, 한방재활의학과, 사상체질과, 침구과"
3443,5480000,055-933-1008,"경상남도 합천군 대양면 대야로 737-20, 1호",합천고려요양병원,301 111 105 104 102 101,"내과, 신경과, 외과, 정형외과, 소아청소년과, 한방내과"
3444,3740000,031-238-9121,경기도 수원시 팔달구 인계로 102 (인계동),백성병원,404 403 402 122 116 110 109 106 105 104 101,"내과, 외과, 정형외과, 신경외과, 마취통증의학과, 산부인과, 영상의학과, 가정의학과, 구강악안면외과, 치과보철과, 치과교정과"
