name,simple_description,department,site,simple_symptom,symptom
뇌전이암 [metastatic brain tumor],다른 부위의 암이 뇌로 전이된 경우,"혈액종양내과, 방사선종양학과, 신경외과",뇌,"두통 , 실인증 , 아린감 , 변비 , 실독증 , 실어증 , 실행증 , 구역 , 구토","증상의 발생은 크게 두개강 내압의 항진과, 신경세포 일부분의 자극이나 파괴에 의해 나타나는 증상으로 나눌 수 있다. 두개강 내압이 올라가는 경우에는 오심, 구토, 두통 등이 있을 수 있으며, 신경세포의 자극이나 파괴에 의해서는 간질 발작과 해당 부위에 따른 신경학적 장애를 유발할 수도 있다.전이성 뇌종양의 증상은 대부분 서서히 나타나지만, 종양 내로 출혈이 발생하는 경우에는 증상이 갑자기 발생할 수도 있다.원인이 되는 종양의 진단 없이 처음 뇌병변에 따른 증상으로 발견되기도 하는데, 이런 경우 체중감소 등의 비특이적인 증상이 동반될 수 있고 원발암의 위치에 따른 증상을 동반하는 경우도 있다."
뇌좌상 [cerebral contusion],외상이나 충격에 의해 뇌 실질에 출혈이 발생한 경우,"신경과, 신경외과, 재활의학과","두부, 뇌","혼수 , 두통 , 후각소실","증상이 없는 경우부터 가벼운 두통, 경미한 또는 심한 마비, 언어 장애, 혼수 상태까지 다양한데 혈종이 발생한 부위에 따라 증상이 결정된다. 예를 들어 혈종이 언어 중추에 발생하면 언어장애, 운동 중추에 발생하면 운동장애 등이 동반될 수 있다."
만성 경막하 출혈 [chronic subdural hemorrhage],3주 이상 경과한 경막하 출혈,신경외과,"머리, 뇌","구역 , 두통 , 구토","노년층에서 많이 발생한다. 주 증상은 두통, 구토, 경도에서 중등도의 한쪽 마비, 언어 장애, 보행장애 등이다. 그러나 노년층에서는 정신 착란, 기억력 장애 등의 증상으로 나타나서 치매, 정신병 등으로 오인되기도 한다"
수두증 [hydrocephalus],뇌실과 지주막하 공간에 뇌척수액이 비정상적으로 축적된 상태,신경외과,"뇌, 척수, 뇌실, 지주막하공간, 상시상 정맥동","두통 , 구역 , 구토","천천히 발생하는 수두증은 연령에 따라서 다양한 증상이 나타난다. 2세 이하의 소아는 아직 두개골이 닫혀있지 않으므로 수두증이 진행되면 머리둘레가 비정상적으로 커지는 모습을 보이게 된다. 대천문이 볼록하게 튀어나오고 때로는 아이가 짜증을 많이 내거나 구토를 하는 모습을 보이며 계속 잠만 자는 경우도 있고, 눈이 아래로 처지거나 안쪽으로 모이는 모습을 보이기도 한다.좀 더 큰 소아는 두통을 주로 호소하게 되는데. 두통은 날카롭지 않고 지속적이며 특히 아침에 깨었을 때 심하다. 구토를 자주 하거나 졸린 모습을 보이기도 하며, 취학 아동의 경우 학교성적이 떨어지고 이상 행동을 보이기도 한다.뇌출혈이나 매우 빨리 자라는 악성 뇌종양에 의한 급성 수두증은 급격한 뇌압 상승을 동반하는 매우 위험한 상황이다. 심한 두통과 구토가 나타나며 의식저하, 팔다리 강직을 보이고 강직성 발작(hydrocephalic fit)을 보이기도 하는 빠른 치료를 요하는 상황이다."
지주막낭종 [arachnoid cyst],뇌를 둘러싸고 있는 지주막하 공간에 뇌척수액이 들어와 생기는 선천적인 낭종,신경외과,"뇌, 뇌실, 지주막하 공간",두통,"뇌 지주막낭종은 전 인구의 0.1~0.7%가 가지고 있다고 알려져 있다. 따라서 대부분의 경우 아무 증상 없이 뇌 전산화 단층촬영(CT)이나 자기공명영상(MRI)을 촬영했다가 우연히 발견되고 있다. 증상은 일부의 환자들에서만 나타나며 낭종의 크기가 커지면서 두통을 일으키거나 주변 뇌 조직을 압박하여 간질 발작을 보이기도 한다. 증상은 주로 소아나 젊은 성인에게 나타나며 나이 많은 성인에서 증상이 나타나는 경우는 매우 드물다. 안상 부위(suprasellar region)의 낭종은 제3뇌실을 압박하여 수두증을 일으키거나 시신경을 압박하여 시력저하, 뇌하수체를 압박하여 호르몬 이상과 성장 장애를 일으키기도 한다. 사구체판과 소뇌교뇌각에 생기는 커다란 지주막낭종도 뇌척수액의 흐름을 막아 수두증을 일으킬 수 있다."
지주막하 출혈 [subarachnoid hemorrhage],뇌의 지주막 아래 공간에 뇌출혈이 일어나는 질환,신경외과,"뇌, 지주막하공간","구역 , 두통 , 구토 , 눈꺼풀처짐","갑작스러운 심한 두통, 심한 구역질과 구토 등의 의식이 있는 경우에서부터 실신이나 의식이 소실되는 경우까지 그 증상이 다양하나, 무엇보다도 특징적인 증상으로는 갑작스럽고 머리를 망치로 맞아 깨질 것 같은 정도의 극심한 두통이다. 이 외에도 안구의 운동이나 동공의 움직임을 지배하는 동안 신경의 마비에 의해 안검하수(윗 눈꺼풀이 늘어지는 현상) 및 복시(사물이 이중으로 보이는 현상), 빛을 싫어하게 되는 광선 공포증이나 목이 뻣뻣해지는 등 전형적인 수막 자극 증상이 나타나며, 경련과 같은 발작을 일으키는 경우도 있다. 때로는 의식장애가 심하고, 혼수상태에서 깨어나지 않은 채 죽는 경우도 있는데, 대체적으로 뇌동맥류 파열 후 3분의 1의 환자가 그 자리에서 즉사하고, 그 외 3분의 1은 병원에 이송 도중 또는 병원에서 사망하게 되며, 나머지 환자만이 치료를 받는 것으로 알려져 있다."
청신경초종 [vestibular schwannoma],청신경의 슈반 세포에서 기원하는 뇌종양,"신경외과, 이비인후과, 방사선종양학과",뇌,"안면 신경마비 , 연하곤란 , 이명","청력감퇴, 귀울림, 어지러움 등의 청신경 압박에 의한 증상으로 병원을 찾는 경우가 대부분이다. 절반 이상의 환자가 초기에 어지러움이나 귀울림을 호소하며 청력감퇴는 서서히 진행하여 이러한 청력저하를 노화현상으로 생각하고 초기에 병원을 찾지 않는 경우도 많다. 간혹 돌발성 난청의 형태로 일어날 수도 있는데 이는 종양의 압박에 의해 청신경이나 달팽이관으로의 혈류장애가 발생하여 일어나는 것으로 생각된다.종양이 점차 커지게 되면 위쪽의 삼차신경이 압박되어 얼굴 부위의 동통이나 감각이상이 발생할 수 있고 아래쪽에 있는 9, 10, 11 뇌신경을 압박하여 음식물을 삼키기 힘들거나, 쉰 목소리 등의 하부 뇌신경 장애 증상을 보일 수도 있다. 종양이 더욱 커져서 소뇌를 압박하게 되면 운동실조 및 평형기능의 장애를 초래하고 제4뇌실을 압박하면 뇌척수액 순환로를 차단하여 폐쇄성 수두증을 초래하기도 한다."
프로락틴종 [prolactinoma],젖분비 호르몬인 프로락틴을 비정상적으로 분비하는 양성 뇌하수체 종양,"내분비내과, 방사선종양학과, 신경외과",뇌하수체,"생리불순 , 구토 , 두통 , 점액수종 , 구역","프로락틴종의 증상은 크게 두 가지로 나누어 생각할 수 있다. 하나는 호르몬의 과다 분비에 의한 증상이며 다른 하나는 종양 자체의 종괴 효과(mass effect)에 의한 것이다.여성의 경우 종양에 의해 프로락틴이 비정상적으로 과다 분비되어 나타나는 증상으로는 월경량의 감소, 초경의 지연, 일차성 무월경, 유즙 분비, 불임, 조기 폐경 등이 있으며 이로 인해 질병을 발견할 수도 있다. 유즙 분비는 전체 환자의 30~80%에서 나타나는 것으로 보고되고 있다. 여성 환자의 약 절반에서 두통을 호소하지만 종양의 크기와 두통은 관계가 없는 것으로 보고되고 있다. 또한 불안, 우울증, 체중 증가가 동반되기도 한다.남성의 경우에는 호르몬의 증가에 의해 성욕 저하, 발기부전 등이 발생하여 이를 통해 종양이 발견되는 경우도 있다.또한 남녀 공통으로 호르몬의 과다 분비는 골다공증을 유발하는 것으로 보고되어 있지만 정확히는 프로락틴이 많아져서가 아니라 성호르몬의 감소에 의해 골다공증이 발생하는 것으로 이해되고 있다.뇌하수체 주변에는 시신경, 동안 신경 등이 존재하는데, 남성과 폐경기 후 여성의 경우 종양이 커져 이런 조직을 압박하면 이러한 신경들의 기능을 떨어뜨리게 되고 그에 따라 시력저하, 사물이 이중으로 보이는 복시, 시야 장애 등이 나타날 수 있다. 또한 종양의 성장으로 인해 뇌척수액의 흐름이 가로 막혀 수두증이 발생하여 두통, 오심, 구토 등이 나타날 수도 있다."
충수염 [appendicitis],맹장 끝 충수돌기에 발생한 염증,외과,충수돌기,"복통 , 체한 경우 , 구역 , 구토 , 위경련","95% 이상에서 복통이 발생한다. 이 외 식욕부진, 오심, 구토(80%)가 있으면서 국소적으로 복부 압통과 발열이 있다. 복통은 초기에는 상복부 통증이 모호하게 있다가 점차 우측 하복부로 국한되어 통증이 발생한다. 그러나, 비전형적으로 증상이 나타날 수 있기 때문에 주의를 요한다.충수돌기의 위치에 따라 우측 옆구리에 통증이 있을 수도 있으며, 골반 내에 위치하는 경우 이급후증(배변 후에도 변을 보고싶은 증상) 및 치골 위쪽의 모호한 불편감이 나타날 수 있다. 이 외에도 장 폐색 증상, 복막염, 변비, 설사 등을 주 증상으로 호소할 수도 있다."
장 중첩증 [intussusceptions],장의 일부가 장의 안쪽으로 들어가는 것,"외과, 소아청소년과","소장, 대장","복통 , 구역 , 구토","장 중첩증의 증상으로 가장 흔한 것은 복통이다. 장 중첩증으로 인한 복통은 갑작스럽게 발생하는 심한 복통이 얼마 동안의 시간을 두고 되풀이하여 계속되는 것이 특징이다. 다시 말해 심한 복통을 호소하며 울고 보채다가 얼마 후 복통이 사라지고 또 얼마 후 이전처럼 심한 복통을 호소하는 식으로 반복되는 것이다. 또한 복통과 함께 구토가 동반되는 경우가 많으며 처음에는 비교적 맑은 구토를 하지만 장 중첩증이 오래되어 장 폐색이 생기면 초록색의 담즙성 구토를 하게 된다.이 밖에 발견할 수 있는 징후로는 복부 종괴(만져지는 덩어리)와 피가 섞인 끈적끈적한 양상(혈성 점액성)의 대변(currant jelly stool)이 있다. 복부 종괴는 환자가 복통을 호소할 당시에 만져지는 경우가 많으며 주로 오른쪽 상복부에서 소시지 모양으로 만져지는 경우가 많다. 혈성 점액성 대변은 장 중첩증 환자에서 보이는 특징적인 양상의 변으로, 이러한 딸기잼 같은 대변을 보면서 주기적인 복통과 구토를 호소할 경우 장 중첩증을 의심해야 한다."
지방종 [lipoma],몸의 지방조직에서 발생하는 성숙한 지방 세포로 구성된 양성 종양,"피부과, 외과","전신, 피하지방층, 근육, 건, 신경초, 내장 기관이나 장간막 등",결절,종양은 주로 1~3cm 크기인 경우가 많으며 피부 바로 밑에서 잘 움직이고 부드러운 고무공처럼 만져지게 된다. 일반적으로 통증은 없으며 오랫동안 크기 변화가 없거나 몇 년에 걸쳐 서서히 자라서 10cm 이상의 거대 지방종(giant lipoma)이 되기도 한다. 크기가 커지는 경우 주변 조직에 붙어서 통증이 생길 수도 있으며 크기 및 위치에 따라 신체의 움직임이나 기능에 영향을 줄 수도 있다.
치루 [anal fistula],항문선의 안쪽과 항문 바깥쪽 피부 사이에 터널이 생겨 구멍으로 분비물이 나오는 현상,외과,항문,"부종 , 혈변","피부 쪽으로 난 구멍을 통해 지속적으로 고름 같은 분비물이 속옷에 묻어 나오게 되며, 항문 주위의 피부 자극과 불편감, 통증을 동반하기도 한다. 간혹 구멍이 막히게 되면 통증과 부종, 열이 발생한다."
치열 [anal fissure],항문관 부위가 찢어지는 현상,외과,항문,"혈변 , 변비","절대 다수는 항문의 중앙선 상에, 특히 후방이 찢어지지만 남자의 약 1%, 여자의 약 10% 에서는 전방에 위치한다. 주로 배변 시 나타나는 날카롭고 찌르는 듯한 통증이 특징적이다. 배변 후 휴지로 닦을 때 피가 휴지나 변에 묻으며, 색깔은 밝은 선홍색이다. 이 외에도 항문관 피부에 궤양, 전초퇴(항문 입구 피부가 늘어진 것), 비후 유두 등이 관찰된다."
치핵 [hemorrhoid],항문 주변의 혈관과 결합 조직이 덩어리를 이루어 돌출되거나 출혈이 되는 현상,외과,항문,"변비 , 혈변","내치핵은 출혈, 탈홍(직장이 탈출된 것)이 발생하며, 혈전(피떡)이 형성되어 괴사가 된 경우에만 통증이 있다. 외치핵은 혈전(피떡)이 형성되어 통증, 가려움증, 피부가 늘어져 나오는 증상이 있을 수 있다."
하지정맥류 [varicose vein],다리의 피부 바로 밑으로 보이는 정맥이 늘어나서 피부 밖으로 돌출되어 보이는 질환,"흉부외과, 외과",하지 정맥계,"부종 , 통증","하지 정맥류가 있으면 발이 무거운 느낌이 나고 다리가 쉽게 피곤해지는 것 같고 때로는 아리거나 아픈 느낌이 들기도 한다. 오래 서 있거나 의자에 앉아 있으면 증상이 더 심해질 수 있고, 특히 새벽녘에 종아리가 저리거나 아파서 잠을 깰 수도 있다.겉으로 보면 피부에 거미줄 모양의 가는 실핏줄처럼 나타나기도 하고, 병이 좀 더 진행되면 늘어난 정맥이 피부 밖으로 돌출되어 뭉쳐져 보이고 만지면 부드럽지만 어떤 곳은 아픈 부위도 있다. 심해지면 피부색이 검게 변하기도 하고 심지어 피부 궤양이 생길 수도 있다."
급성 부비동염 [acute sinusitis],급성으로 발생한 부비동 점막의 염증성 질환의 통칭,"이비인후과, 소아청소년과, 호흡기내과, 가정의학과","비강, 부비동","두통 , 비폐색 , 호흡장애 , 기침 , 비루 , 폐쇄성 비음 , 후각소실 , 만성 기침","급성 부비동염의 증상은 상기도 감염 시에 나타나는 코막힘과 비루(콧물), 발열, 권태감, 졸림 등이다. 심한 경우 얼굴 부위의 압통과 두통이 동반되기도 한다. 농이 생길 경우 코로 흘러내리기도 하고, 일부는 코에서 목 뒤로 넘어가는데 이를 뱉어내면 농이 누런색이나 초록색을 띠고 있는 경우도 있다. 코가 막히면 냄새를 맡을 수 없게 되기도 하고, 이상한 냄새가 나기도 한다. 다른 증상 없이 기침만 호소하는 경우도 있다."
급성 인두염 [acute pharyngitis],바이러스나 세균 등의 감염에 의해 인두에 염증이 생긴 질환,"이비인후과, 소아청소년과, 가정의학과, 호흡기내과",인두,인두통 및 인후통,"초기에는 인두의 이물감, 건조감, 가벼운 기침 정도의 증세가 나타나고, 심해지면 통증, 연하곤란(음식을 삼키기 어려운 증상), 고열, 두통, 전신 권태, 식욕 부진 등을 호소하게 된다. 또한 입에서 냄새가 나고, 혀에 설태가 끼거나, 귀 밑 부분에 통증이 발생하고, 심한 경우에는 경부 림프절 종대와 통증을 호소할 수 있다."
급성 편도염 [acute tonsillitis],주로 구개편도에 발생하는 급성 염증,"호흡기내과, 가정의학과, 이비인후과, 소아청소년과",편도,"애성 , 연하곤란 , 발열 , 인두통 및 인후통 , 이통 , 구취 , 두통","대부분의 경우 갑작스러운 고열과 오한이 나타난다. 뒤이어 인후통이 발생하고, 인두근육에 염증이 생기면 연하곤란 증상이 나타난다. 환자는 두통, 전신 쇠약감, 관절통 등의 신체 전반에 걸친 증상을 호소한다. 혀의 표면이나 구강 내에 두껍고 끈적끈적한 점액이 있을 수 있다. 압통성의 경부임파선 비대 역시 흔하게 나타난다. 이러한 증상들은 대개 4~6일 정도 지속되고, 합병증이 없으면 점차 사라진다."
급성 폐쇄성 후두염 [acute laryngotracheobronchitis],"목이 쉬거나 목소리에 변화가 오고, 숨을 들이마쉴 때 소리가 나며, 개 짖는 소리와 비슷한 기침, 호흡곤란 및 흉벽 함몰 등의 증상이 나타나는 질환","이비인후과, 소아청소년과",목(후두),"인두통 및 인후통 , 발열 , 기침 , 호흡장애 , 만성 기침","급성 폐쇄성 후두염 환자는 초기에는 발열을 동반한 상기도 감염증의 증상을 호소하고, 수일 후 특징적인 개기침(barking cough) 소리가 나타난다. 이 때 발생하는 기침은 보통 가래를 동반하지 않으며 밤에 악화되는 특징이 있다. 드물게 성문하 부종으로 인한 호흡곤란이 나타날 수 있다."
"급성 후두염 및 기관염 [acute laryngitis, tracheitis]",바이러스나 세균 등의 감염에 의해 급성으로 후두와 그 주변 조직에 염증이 발생하는 상태,"호흡기내과, 가정의학과, 이비인후과, 소아청소년과",목(후두 및 기관),"인두통 및 인후통 , 만성 기침 , 기침 , 애성 , 연하곤란 , 발열","일반적으로 음식물이나 침을 삼킬 때 인두 이물감이나 통증이 발생한다. 급성 후두염을 방치할 경우 인두, 편도, 비강, 기관지 등의 주변 조직으로 염증이 진행되어 기침, 가래, 콧물, 코막힘 등의 증상이 발생할 수 있다. 이 외에도 목소리의 변화가 나타나고 발성이 힘들 수 있으며, 발열과 근육통 등의 전신 증상을 동반할 수 있다."
"식중독 및 장염 [food poisoning, gastroenteritis]",인체에 유해한 미생물 또는 유독 물질이 들어있는 식품의 섭취로 인하여 발생하였거나 발생한 것으로 판단되는 감염성 또는 독소형 질환,"소아청소년과, 소화기내과, 가정의학과","위장, 소장, 대장","위경련 , 체한 경우","원인 물질에 따라 잠복기와 증상의 정도가 다르게 나타나게 되는데, 일반적으로 음식물 섭취 후 72시간 이내에 구토, 설사, 복통, 발열 등의 증상을 나타낸다."
만성 부비동염 [chronic sinusitis],부비동의 염증성 질환인 부비동염이 회복되지 않고 3개월 이상 지속되는 경우,"이비인후과, 소아청소년과","코, 부비동","두통 , 후각소실 , 구취 , 기침 , 비폐색 , 히스테리구 , 만성 기침","코막힘, 지속적인 누런 콧물, 얼굴 통증, 코 뒤로 넘어가는 콧물(후비루) 등의 증상이 나타난다. 더 진행되면 후각감퇴, 두통 및 집중력 감퇴 등을 호소하고, 중이염이나 기관지염이 생기기도 한다. 기관지 천식이 있는 경우에는 이러한 증상이 더욱 악화될 수 있다. 또한 콧물이 뒤로 넘어가면서 기침을 유발하기도 한다. 따라서 3주 이상 지속되는 만성 기침이 있는 경우 부비동염이 원인일 수 있다."
만성 비염 [chronic rhinitis],"비루(콧물), 재채기, 가려움증, 코막힘 중 한 가지 이상의 증상을 동반하는 비점막의 염증성 질환",이비인후과,코,"비루 , 재채기 , 후각소실 , 인두통 및 인후통 , 비폐색 , 폐쇄성 비음 , 히스테리구","원인에 관계없이 대부분의 만성 비염 환자들은 증상의 심한 정도의 차이만 있을 뿐 비슷한 임상적 양상을 보인다. 코막힘이 주된 증상으로, 보통 좌우가 교대로 막히며 증상의 정도가 다양하다. 심할 때에는 양쪽 코가 모두 막혀 코로 숨을 쉬는 것이 힘들어지므로 환자는 입을 통해 호흡을 하게 된다. 비루(콧물) 역시 잘 나타나는 증상이며, 대개의 경우 수양성 비루(맑은 콧물)이다. 그러나 세균에 감염되었을 때에는 황록색의 화농성 비루로 변하기도 한다. 비강의 분비물이 후비공(뒤쪽 콧구멍)으로 흘러내리는 경우가 많이 발생하는데, 이를 후비루라고 한다. 만성 비염은 염증으로 인해 비점막의 신경이 노출되면서 발작성 재채기를 일으키기도 하고, 후각소실이나 후각감퇴의 원인이 되기도 한다."
만성 후두염 [chronic laryngitis],감염성 및 비감염성 원인으로 발생한 후두의 만성 염증,이비인후과,귀(후두),"기침 , 애성 , 피로 , 인두통 및 인후통 , 만성 기침 , 발열","만성 후두염의 대부분의 원인은 인후두 역류질환인 경우가 많다. 따라서 만성 후두염 환자들은 발열, 통증, 연하 곤란 등의 염증에서 비롯되는 증상보다는 목소리 변화와 기침, 인두 이물감, 음성피로 등의 증상을 주로 호소한다. 또한 급성 후두염에 비해 실제 성대 부위에 병적인 변화가 동반되어 있을 가능성이 높다."
메니에르병 [Meniere’s disease],"내이에 발생하는 질환으로, 난청, 현기증, 이명(귀울림)의 3대 증상을 특징으로 하는 질환",이비인후과,귀(내이),"안진 , 어지럼증 , 이명 , 구역 , 구토 , 설사 , 두통","발병 초기에 그 정도가 변하는 난청이 저주파수대에서 시작되며, 이는 메니에르병의 특징적인 증상이다. 이후 점차 병이 진행되면서 고음역에서 청력 소실이 발생한다. 고음역에서 먼저 청력 변화가 시작되는 경우도 있다. 난청은 가장 흔한 증상으로, 초기에는 한쪽 귀에서만 나타나고, 병이 진행되면 20~50% 정도의 환자에서 양측 모두에 증상이 나타난다. 초기에 회전성 현기증은 격렬한 증상으로 나타나고 오심, 구토를 동반하며, 돌발적으로 발생하고, 20~30분 내지 수시간 동안 지속된다.이명(귀울림)의 정도는 난청의 정도와 직접적인 관계가 있으며, 강도나 음고의 변동이 심하다.그 외에 귀에 무엇이 꽉 차 있거나 막힌 듯한 느낌이 들 수 있는데, 이를 이 충만감이라고 한다. 이 충만감은 발작의 신호로서 나타날 수 있으며, 환자의 약 절반 정도에서 나타나는 증상이다. 또한 오심과 구토를 동반하는 자율신경계 자극 증상, 즉 두통, 뒷목 강직, 설사 등의 증상이 동반될 수 있다."
비용종 [nasal polyp],포도송이 모양의 양성 부종성 점막이 비강 내로 돌출된 것,이비인후과,"코, 비강","두통 , 비루 , 비폐색 , 재채기 , 호흡장애 , 후각소실","비용종은 크기가 작은 경우에는 특별한 증상이 없지만, 점점 크기가 증가하면서 다양한 증상이 나타날 수 있다. 초기 증상으로는 비용종의 크기나 위치에 따라 정도의 차이는 있지만 코막힘을 호소하며, 후각의 감소와 미각의 변화를 호소하기도 한다. 수양성 비루(물 같은 콧물)와 재채기 등 알레르기 비염과 유사한 증상을 호소하기도 하며, 콧등이나 전두부(앞이마)의 통증은 이차적 부비동염이 있는 경우 더욱 심해진다. 또한 농성 후비루(postnasal drip, 누런 또는 녹색의 콧물이 코 뒤로 넘어가는 것)가 지속되면 이관염을 일으키고, 하기도를 자극하여 기침을 유발하기도 하며, 천식을 악화시키기도 한다. 폐쇄성 비음을 호소하는 경우도 있으며, 아주 심한 경우에는 해부학적 변화를 일으켜 콧등이 넓어지기도 한다."
비중격 만곡증 [deviated nasal septum],비중격이 휘어져 코와 관련된 증상이나 기능적 장애를 유발하는 상태,이비인후과,"코, 비중격","두통 , 비출혈 , 비폐색 , 호흡장애","비중격 만곡증의 증상은 매우 다양하지만, 가장 주요한 증상으로 코막힘이 있다. 좁아진 쪽의 코가 막히는 경우가 많지만, 만곡된 쪽과 코막힘을 느끼는 쪽이 항상 일치하지는 않으며 오히려 넓은 쪽의 코가 막힌다고 느끼는 경우도 있다. 또한 비중격 만곡증이 장기간 유지되었을 경우, 넓은 쪽 코에서 보상반응에 의하여 하비갑개의 점막이 점점 두꺼워지는 비후성 비염이 생길 수 있다.이외에도 비중격 만곡증에 의해 후비루(콧물이 코뒤로 넘어가는 것), 구(입술)호흡, 두중감(머리의 무거움), 기억력 감퇴, 주의 산만, 수면 장애, 수면 무호흡, 폐쇄성 비음, 후각장애 등의 증상이 생길 수 있고, 감기와 같은 급성 비염이 잘 발생하게 된다. 특히 만곡된 부위가 비강의 측벽을 눌러 자극하는 경우, 주변의 지각신경이 압박되어 두통이나 안면통 등의 통증이 수반되기도 한다. 만곡이 심하여 정상적인 점액의 이동이 방해 받거나, 비강 내 기류의 변화로 점막이 화생(일정한 형태와 기능을 가진 정상적인 조직이 어떠한 원인 때문에 전혀 다른 형태와 기능을 가진 조직으로 비가역적으로 전환하는 현상)하는 등의 변형이 일어난 경우에는 만성 비부비동염으로 이어질 수도 있다."
