name,simple_description,department,site,simple_symptom,symptom
협심증 [angina pectoris],"심장혈관이 동맥경화증, 혈전, 경련수축(연축) 등의 원인에 의해 협착되어 심근에 허혈이 생기면서 나타나는 질환","순환기내과, 흉부외과",심장,"가슴통증 , 호흡장애","환자는 대부분 급성 통증 또는 운동이나 활동 시에 발생하는 통증을 호소한다.대개 '가슴이 쥐어짠다', '가슴이 싸한 느낌이 든다'고 호소하며, 주로 가슴의 정중앙 또는 약간 좌측 부위에 통증을 호소하는 경우가 많다. 그러나 이러한 증상 없이도 '명치가 아프다' 또는 '턱끝이 아프다'라고 호소하는 경우도 있고, 전형적이지는 않지만 '속이 아프다', '가슴이 쓰리다'고 호소하는 환자도 있다.흉통은 호흡곤란을 동반하는 경우가 많으며, 좌측 어깨 또는 좌측 팔의 안쪽으로 퍼지는(방사) 경우도 있다. 대개는 운동이나 활동을 할 때, 감정적인 스트레스를 받을 때 유발되는 경우가 많지만 관상동맥의 협착 정도가 아주 심하거나 급성으로 혈전이 생기는 경우에는 휴식 시에도 유발될 수 있으므로 이와 같은 경우는 특별한 주의가 요구된다.흉통의 지속 시간은 대개 5분 이내이고, 30분 이상 지속되는 경우는 거의 없다. 또한 급성 심근경색증과는 달리 니트로글리세린 설하정을 혀 밑에 투여하면 통증이 호전되거나 소실되는 경우가 많다. 드물지만 경우에 따라서는 흉통을 호소하면서 갑작스런 실신이나 심장마비로 응급실에 내원하는 경우도 있는데, 이는 대부분 급성으로 광범위한 부위에 걸쳐서 심근 허혈이 발생했기 때문이다."
확장성 심근병증 [dilated cardiomyopathy],심장 근육의 이상으로 인해 심장이 확장되고 심장 기능은 저하되는 심장 질환,"순환기내과, 흉부외과, 소아청소년과",심장,"호흡장애 , 가슴통증 , 부종","증상은 대개 점진적으로 나타나는데, 어떤 경우는 무증상으로 수개월 내지 수년간 지내다 나중에 증상이 발생하거나 흉부 X-선 촬영에서 우연히 심장 비대 소견으로 발견되는 경우도 있다. 가장 흔한 증상은 심장 기능이 저하됨(심부전)에 따른 활동 시 피로감, 쇠약감, 운동능력 저하 등이다. 질병이 진행하면서 심부전의 증상으로 호흡곤란이 발생한다. 대개 우심실 기능은 유지되는 경우가 많은데 우심실 기능 저하에 따른 복수(복부에 물이 차는 것), 목 정맥 확장, 간 비대, 부종이 동반되면 예후가 나쁜 것으로 알려져 있다."
신경성 식욕부진증 [anorexia nervosa],체중 감소를 위한 비정상적인 행동을 보이는 대표적인 섭식 장애,정신건강의학과,"뇌, 팔, 다리","구역 , 부종 , 구토","일반적으로 증상의 시작은 10세에서 30세 사이에 시작된다.체중 증가와 비만에 대한 강한 두려움이 존재하고 치료에 무관심하거나 저항한다.체중 감소와 연관된 부적절한 식이 행동은 비밀스럽게 이루어지는 경우가 많고 가족과 함께 또는 공공장소에서 식사하는 것을 꺼려한다.식욕부진(anorexia)이란 용어는 잘못 사용된 면이 있는데, 실제 식욕이 감소한 경우는 질환 말기에 이르기 전까지는 흔하지 않다. 폭식이 동반되는 경우가 있는데 대체로 비밀스럽게 이루어지고 밤에 이루어지는 경우가 많다. 폭식 이후에는 스스로 구토를 유도하거나 하제를 이용하여 제거하는 행동이 따르는 경우가 흔하다.하제와 이뇨제를 남용하고 상당한 양의 운동을 습관적으로 행하는 경우가 흔하다.음식을 온 집안에 숨겨 놓는 등의 음식과 관련된 부적절한 행동을 보이는 경우가 흔하다.체중 감소가 심각한 경우 저체온증, 무월경, 부종, 그리고 저혈압 등의 다양한 내과적 문제가 발생한다."
공황장애 [panic disorder],특별한 이유 없이 예상치 못하게 나타나는 극단적인 불안 증상이 주요한 특징인 질환,정신건강의학과,뇌,"호흡장애 , 불안 , 발한 , 아린감 , 심계항진 , 공포","첫번째 공황발작은 흥분, 신체적인 활동, 성 행위, 감정적 상처 등에 뒤따라서 생길 수 있으나 이유 없이 자발적으로 생기는 경우가 흔하다. 증상이 발생하면 보통 10분 안에 증상의 정도가 최고조에 이른다.공황발작이 나타나기 전에 반복해서 있었던 사건이 있다면(예: 커피, 술, 담배를 복용했거나 수면변화, 식사변화, 과도한 조명 등이 있은 후에 발작), 이런 조건에 대해 자세히 조사해 봐야 한다.주요한 정신 증상은 극도의 공포와 죽음에 이를 것 같은 절박한 느낌이다. 보통 환자들은 이런 공포의 원인을 알지 못하고 혼돈스러워하고 집중력이 떨어진다. 빈맥(빠른 맥박), 심계항진, 호흡곤란, 발한과 같은 신체 증상(자율신경계 증상)이 나타나는데 대개 발작은 20~30분 지속되고 1시간을 넘기는 경우는 거의 없다.예기 불안이 또 다른 주요 증상인데 한 번 발작을 경험하게 되면 다음 발작이 있지 않을까 하는 두려움에 불안해하는 것을 말한다.심장과 호흡문제와 관련된 신체증상이 공황발작 시 환자가 가장 걱정하는 문제이며, 자신이 곧 죽을 것이라는 생각에 응급실을 방문하는 경우가 많다. 다섯에 한 명 정도는 공황발작 시 실신에 이르기도 한다.공황발작과 흔히 동반되는 광장 공포증은 자신이 남에게 도움을 받기 어렵다고 판단되는 장소를 가지 않으려고 하는 공포증을 말한다. 번잡한 거리, 번잡한 가게, 밀폐된 공간(터널, 다리, 승강기), 밀폐된 차량(지하철, 버스, 비행기)에 가거나 이용하는 것은 반드시 친구나 가족과 동반하려 한다. 심한 경우엔 아예 집을 나가려고 하지도 않는다.이런 행동은 부부 문제를 만들어 부부 문제가 주요한 문제로 오진하게도 한다. 정확한 진단이 내려지기 전에 환자는 스스로가 이상해지고 있다고 두려워할 수 있다."
망상장애 [delusional disorder],망상이 주된 증상인 정신과적 질환,정신건강의학과,뇌,섬망,"환자는 일반적으로 일상생활에 문제가 없고 성격이나 외모에 있어 뚜렷한 문제가 보이지 않으나, 의심스럽고 적개심이 많고 다소 이상하고 기묘하게 보일 수도 있다. 기분은 망상의 성격에 따른다. 정신분열증에서 보이는 환청 등의 심각한 지각이상을 보이지 않고 망상도 체계적이며 기괴하지 않다. 또한 망상 외의 사고 장애를 보이지 않는다."
해리성 정체감 장애 [dissociative identity disorder],정체성 결여 문제로 자신이 누군인가에 대해 혼돈스러워하고 때로는 자신을 다수의 인격으로 경험하는 장애.,정신건강의학과,"뇌, 팔, 다리",섬망,일반적으로 해리성 정체감 장애 환자들이 가지는 다중 인격의 수는 평균 5~10가지 정도이다.성격간의 이동은 때로는 매우 급작스럽고 드라마틱하게 이루어진다. 환자들은 각각의 성격에서 경험한 것들을 일반적으로 기억하지 못한다. 그러나 경우에 따라서는 다른 성격의 존재를 완벽하게 인지하기도 하고 때로는 본인이 아닌 친구 같은 남으로 경험하기도 한다. 성격은 성을 달리 할 수도 있고 원래 가족의 기원과 다른 인종과 나이를 가지기도 한다.
고혈압성 신장 질환 [hypertensive nephropathy],지속적인 고혈압에 의해 신장 기능이 저하되는 질환,"신장내과, 소아청소년과",신장,"단백뇨 , 구역 , 부종 , 구토 , 혈뇨","초기에는 고혈압 이외에는 증상이 없을 수 있다. 그러나 점차 진행이 되면서 혈압 조절이 잘 되지 않고, 혈뇨나 단백뇨가 나오기도 하며, 소변량이 감소할 수 있고, 부종이 나타난다. 신장질환이 더 진행하여 신장의 기능이 떨어지면 기운 없음, 메스꺼움, 구토, 빈혈 등의 증상이 나타난다."
급성 신부전 [acute renal failure],신장 기능의 급격한 장애를 보이는 질환,"신장내과, 소아청소년과","신장, 심장, 폐",핍뇨 및 무뇨,"소변량이 하루 400cc 미만으로 감소하는 핍뇨 증세가 흔히 나타나지만 소변량이 줄지 않는 경우도 있다. 이 외의 전체적인 신체 증상은 다양하며, 이 중 감염증은 사망의 주된 원인(30~70%)이 될 수 있다. 그 외의 전신 증상은 아래와 같이 나누어 볼 수 있다.1) 신경계: 의식 혼탁, 경련2) 심혈관계: 고혈압, 부정맥, 허혈성 심장질환3) 호흡기계: 폐부종, 폐출혈4) 위장관계: 식욕부진, 구토, 장 마비, 위장관 출혈"
급성 신우신염 [acute pyelonephritis],요로감염의 일종으로 신장에 세균이 감염되어 발생하는 질환,"신장내과, 비뇨기과, 소아청소년과",신장,"혈뇨 , 거품뇨 , 배뇨통 , 발열","허리 통증과 발열 등이 주된 증상이며, 방광염을 동반한 경우에는 방광염의 증상인 긴급뇨(갑자기 소변이 보고 싶어 달려가다가 소변을 보는 것), 절박뇨(절박하게 소변이 마려우며 소변을 참지 못함), 배뇨통 등이 동반된다. 심한 감염의 경우에는 혈뇨를 보이기도 한다."
당뇨병성 신장 질환 [diabetic nephropathy],"당뇨병에 의해 나타나는 합병증으로, 고혈당 등에 의해 지속적으로 신장 내부의 사구체가 손상되어 신장 기능이 저하되는 질환","내분비내과, 소아청소년과, 신장내과",신장,"단백뇨 , 거품뇨 , 구역 , 구토","초기에는 대부분 증상이 없다. 따라서 정기적인 소변 검사로 미세알부민뇨에 대해 측정하는 것이 중요하다. 당뇨병성 신장질환이 진행될수록 소변 검사에서 단백뇨가 나타나고, 단백뇨의 양이 많아지면 소변에 거품이 나며, 하지 부종 등이 나타날 수 있다. 초기에는 소변량이 정상이거나 오히려 다소 증가하는 경우도 있다. 신장질환이 진행된 뒤에는 신장 기능이 감소하기 시작하여 혈액 내에 노폐물이 쌓이고, 혈액검사에서 요독 수치 및 크레아티닌 수치가 증가한다. 이 경우 환자에 따라 기운 없음, 쉽게 피로함, 빈혈, 메스꺼움, 구토, 소변량 감소 등의 증상이 나타날 수 있고, 일부 환자에서는 약물이 신장으로 잘 배설되지 않아 저혈당 증상이 나타나기도 한다."
만성 신부전 [chronic renal failure],3개월 이상 신장이 손상되어 있거나 신장 기능 감소가 지속적으로 나타나는 질병,"소아청소년과, 신장내과","신장, 심장","구역 , 호흡장애 , 구토 , 빈뇨 및 야간뇨","신부전의 초기에는 별다른 증상을 느끼지 못하지만 신장 기능이 저하되면서 피곤함, 가려움증, 식욕부진 등의 요독증상이 나타난다. 말기 신부전에 이르면 호흡곤란, 식욕부진 및 구토 등의 증상이 더욱 심해지면서 투석이나 신장이식 등의 치료를 받지 않으면 정상적인 생활을 할 수 없는 상태가 된다."
신장암 [renal cell carcinoma],신장에서 소변을 만드는 세포들이 모여 있는 부분인 실질에서 발생하는 악성종양,"신장내과, 방사선종양학과, 비뇨기과, 혈액종양내과",신장,혈뇨,"신장암은 종양의 크기가 작을 때는 증상이 거의 없으며, 종양이 어느 정도 커져서 장기를 밀어낼 정도가 되어야 비로소 증상이 나타난다. 따라서 진단이 늦어지는 경우가 많아 처음 진단될 때 환자의 30% 정도는 이미 전이된 상태로 나타나게 된다. 가장 흔한 증상은 혈뇨(hematuria)이지만 이것도 환자의 60%에서만 나타난다. 오히려 전이된 부위에 따라 호흡곤란, 기침, 두통 등의 증상이 나타나 이러한 전이 증상 때문에 신장암을 진단하게 되는 경우도 전체 환자의 30%에 이른다. 신장암은 특별히 암세포가 생산하는 특정 호르몬 때문에 고혈압, 고칼슘혈증, 간기능 이상 등을 일으킬 수 있기 때문에 이런 다른 증상을 검사하던 중 종양이 발견되는 경우도 있다. 그러나 최근에는 아무 증상 없이 건강진단을 받던 중 우연히 영상검사상에서 발견되는 경우가 많은데, 이런 경우는 주로 초기에 발견되기 때문에 치료 결과가 비교적 좋다."
신증후군 [nephrotic syndrome],"다량의 단백뇨와 저알부민혈증, 부종, 고지혈증 등의 증상이 나타나는 질환","소아청소년과, 신장내과",신장,"부종 , 단백뇨 , 거품뇨","단백뇨에 의해 소변에 거품이 나타나게 되며, 저알부민혈증에 의해 부종이 발생한다. 신증후군을 일으키는 원인 질환에 따라 신장 기능이 감소하는 경우도 있으며, 그 경과는 원인 질환에 따라 급격히 또는 천천히 진행될 수 있다."
각막염 [keratitis],"통증, 충혈, 시력 감소 등을 초래하는 각막에 생긴 염증성 질환",안과,눈,"눈 분비물 , 눈물 , 눈의 통증 , 유두상비대 , 충혈 , 시력 감소","각막염의 주된 초기 증상은 시력 감소와 통증, 충혈, 눈물 흘림, 눈부심 등이다. 각막은 다섯 개의 층으로 구성되어 있는데(바깥쪽부터 각막상피, 보우만막, 각막실질, 데스메막, 각막내피), 가장 바깥쪽 각막상피의 결손이 생기고 각막실질에 염증반응으로 인한 혼탁이 생기면 시력 감소를 초래하게 된다. 염증이 심한 경우에는 각막 전체가 파괴되기도 한다."
결막염 [conjunctivitis],눈을 외부에서 감싸고 있는 조직인 결막에 생긴 염증성 질환,안과,눈,"결막하 출혈 , 여포 , 충혈 , 눈곱 , 결막부종 , 눈 분비물 , 막, 위막 , 유두상비대 , 눈물 , 눈 이물감","본인이 느낄 수 있는 자각증상으로 통증, 이물감(눈에 무엇인가 들어있는 느낌), 눈곱, 눈물, 가려움증(알레르기성 결막염) 등이 있고, 겉으로 드러나는 증상으로는 충혈, 결막부종, 결막하출혈, 여포, 위막(가성막) 등이 있다."
녹내장 [glaucoma],안압의 상승으로 인해 시신경에 장애가 생겨 시야 결손 및 시력 손상을 일으키는 질환,안과,눈,"구역 , 충혈 , 두통 , 구토","녹내장을 분류하는 기준은 다양하며, 크게 급성과 만성으로 나누어 증상을 설명할 수 있다. 급성 녹내장은 전체 녹내장의 약 10% 정도를 차지하며, 안압(안압의 정상범위는 10~21mmHg)이 급속도로 높아지면서 시력 감소, 두통, 구토, 충혈 등의 증상이 나타난다.만성 녹내장에서는 시신경이 서서히 파괴되므로 특별한 증상을 느끼지 못하다가, 시야가 좁아지는 말기에 이르러 답답하다고 느끼며, 더 진행되면 실명에 이르게 된다."
눈다래끼 [hordeolum],눈꺼풀에 있는 분비샘에 생긴 염증,안과,눈,결절,"겉다래끼는 눈꺼풀의 가장자리가 부으면서 통증이 생기고 해당 부위가 단단해져(경결) 압통이 심해지는데, 시간이 지나면서 염증에 의한 물질들이 피부로 배출(배농)된다.속다래끼는 겉다래끼보다 깊이 위치하며, 결막(눈꺼풀을 뒤집으면 보이는 빨간 점막조직)면에 노란 농양점이 나타난다. 염증 초기에는 경결이 만져지지 않고, 눈꺼풀이 약간 불편하면서 누르면 미세한 통증이 있다가 점점 진행된다.콩다래끼는 눈꺼풀 가장자리 피부 밑에서 단단한 결절이 만져지지만, 붓거나 통증과 같은 염증 증상은 없다."
"망막 박리 및 망막 열공 [retinal detachment, retinal tear]","망막의 두 층, 즉 안쪽의 감각신경층과 바깥쪽의 색소상피층이 분리되거나(망막 박리), 망막에 구멍이 생긴 상태(망막 열공)",안과,눈,비문증,"망막 박리를 암시하는 전구 증상이 있는데, 이는 눈 앞에 번쩍거리는 것이 보이거나(광시증), 먼지 같은 것이 보이는 것(비문증)을 말한다.망막 열공이 생기는 과정에서 망막 혈관이 손상되면 유리체 내에 출혈이 발생하여 시력이 감소되며, 견인 및 삼출액에 의한 망막 박리 경우에도 시력 감소가 나타난다.망막 박리는 흔히 주변부에서 시작되어 중심부로 진행되어 시야가 좁아지게 되는데, 환자들은 눈 앞에 검은 장막이 쳐진 것처럼 일부는 보이고 일부는 보이지 않아 마치 커튼이 쳐진 것 같다고 호소한다. 망막 박리가 황반부까지 진행되면 시력이 심하게 감소되고, 변형시(사물이 찌그러져 보이는 증상)와 색각 장애(색맹)도 나타날 수 있다."
바이러스 결막염 [viral conjunctivitis],바이러스에 의한 결막의 염증,안과,눈,"결막부종 , 눈 분비물 , 충혈 , 결막하 출혈 , 막, 위막 , 여포","본인이 느낄 수 있는 자각증상으로 통증, 이물감(눈에 무엇인가 들어있는 느낌), 눈곱, 눈물흘림 등이 있고, 밖으로 드러나는 증상으로는 충혈, 결막부종, 결막하출혈, 여포, 위막(가성막) 등이 나타날 수 있다."
아폴로눈병 [acute hemorrhagic conjunctivitis],바이러스에 의한 결막의 급성 출혈성 염증,안과,눈,"결막하 출혈 , 눈 분비물 , 결막부종 , 여포 , 충혈","본인이 느낄 수 있는 자각 증상으로 통증, 이물감(눈에 무엇인가 들어있는 느낌), 눈물흘림이 있고, 겉으로 드러나는 증상으로는 충혈, 결막부종, 결막하출혈, 여포, 눈꺼풀 종창 등이 나타날 수 있다."
안구건조증 [dry eye syndrome],눈물이 부족해서 눈에 자극을 일으키는 눈물막의 질환,안과,눈,"눈 이물감 , 충혈","눈이 시리고 모래알이 들어간 듯한 이물감이 있으며 콕콕 쑤시는 느낌을 호소한다. 쉽게 눈이 피로하여 잘 뜰 수가 없고, 눈을 감고 있으면 편하며, 눈을 뜨면 증상이 심해진다. 특히 겨울철 외출 시 찬 바람을 맞으면 눈물이 줄줄 흐르며, 심한 경우 두통을 호소하기도 한다. 외관 상 눈이 약간 충혈되어 있다. 이런 여러 증상은 한 사람에게 모두 나타나는 것은 아니고 이 중 하나 혹은 여러 개의 증상을 함께 보이게 된다."
외안의 이물 [extraocular foreign body],"눈꺼풀, 각막, 결막 등에 이물질이 있는 상태",안과,눈,충혈,"눈은 매우 예민한 기관이기 때문에 이물이 눈에 들어가면 이물감과 통증, 눈물, 충혈이 생기며, 눈을 뜨기 어려워진다."
유행성 각결막염 [epidemic keratoconjunctivitis],아데노 바이러스에 의해 결막에 생긴 급성 염증성 질환,안과,눈,"결막하 출혈 , 충혈 , 결막부종 , 여포","본인이 느낄 수 있는 자각증상으로 충혈, 중등도의 통증, 이물감(눈에 무엇인가 들어있는 느낌), 눈곱, 눈물 흘림 등이 있고, 겉으로 드러나는 증상에는 충혈, 결막부종, 여포, 눈꺼풀 종창(부어 오름) 등이 있다."
초자체 출혈 [vitreous hemorrhage],안구의 내부를 채우고 있는 초자체(유리체) 내부의 출혈,안과,눈,비문증,"가벼운 출혈일 경우에는 시력장애 없이 비문증(날파리증)을 느끼게 되고, 심한 출혈일 경우에는 앞이 전혀 보이지 않을 정도의 시력 감소를 보인다. 즉, 출혈의 정도에 따라 증상이 다양하게 나타난다."
포도막염 [uveitis],"우리 눈의 홍채, 모양체, 맥락막으로 구성된 포도막에 생긴 염증",안과,눈,"충혈 , 비문증","포도막염은 다양한 원인과 염증정도에 따라 증상도 다양하게 나타나지만, 대표적인 증상으로 시력저하, 날파리증, 통증, 충혈, 눈물흘림, 눈부심 등이 있다.전포도막염(안구의 앞쪽 포도막에 생긴 염증, 홍채모양체염이라고도 함)일 때는 시력장애보다는 충혈과 눈부심, 통증이 심하고, 후포도막염(안구의 뒤쪽 포도막에 생긴 염증)일 때는 시력저하와 날파리증이 주 증상으로 눈부심, 변시증(사물이 찌그러져 보이는 현상)이 생길 수 있다."
두드러기 [hives],피부나 점막에 존재하는 혈관의 투과성이 증가되면서 일시적으로 혈장 성분이 조직 내에 축적되어 피부가 붉어지거나 흰색으로 부풀어 오르고 심한 가려움증이 동반되는 흔한 피부질환,"알레르기내과, 소아청소년과, 피부과, 가정의학과",피부,"소양감 , 구토 , 호흡장애 , 홍반 , 구역 , 설사","피부가 부어 오르면서 소양증(가려움증)을 동반하고, 피부의 병리적 증상이 3~4시간 후 사라졌다가 다시 다른 부위에 생긴다. 대개의 경우 각각의 피부의 병리적 변화는 12~24시간 이내에 사라지지만, 두드러기 혈관염이나 구진 두드러기 등은 하루 이상 지속되기도 한다. 몸 속 체온이 상승했을 때 나타나는 콜린성 두드러기는 전형적인 두드러기보다 훨씬 작은 수 mm의 크기로 생기는 것이 특징적이다.두드러기가 생겼을 때 눈 주위나 입술이 퉁퉁 붓는다면 혈관부종이 동반된 경우이며, 복통, 메스꺼움, 구토 등의 소화기 증상이나 쉰 목소리, 호흡곤란 등의 호흡기 증상이 동반될 수 있다. 두드러기와 혈관부종은 신체의 어느 부위에서나 발생할 수 있으며, 특히 혈관부종은 주로 얼굴이나 팔, 다리에 나타나고 가려움 보다는 화끈거리거나 따끔거리는 증상으로 나타나며 며칠 동안 증상이 지속될 수도 있다."
아토피 피부염 [atopic dermatitis],가려움증을 주된 증상으로 하는 만성적인 염증성 피부질환으로 주로 영유아기에 시작됨,"피부과, 소아청소년과, 알레르기내과",피부,"소양감 , 작열감 , 피부 건조증","심한 소양증(가려움증)과 피부건조증, 피부 병변이 주요 증상이다.피부건조는 가려움증을 유발하고 악화시킨다. 낮 동안에는 간헐적으로 가렵다가 대개 초저녁이나 한밤중에 심해진다. 가려워서 긁게 되면 습진성 피부 병변(병리적 변화)이 생기고 이러한 병변이 진행되면서 다시 더 심한 가려움이 유발되는 악순환이 반복된다.피부 병변의 분포와 반응 양상은 환자의 연령에 따라 다소 다르게 나타난다. 유아의 경우 병변이 주로 진물이나 딱지가 지는 급성 습진이 나타나며 주로 얼굴, 머리에 잘 생기고 몸통이 거칠고 건조하며, 팔다리의 바깥쪽에 생기는 경우가 많다. 2세 이상 10세 이하의 소아기에는 얼굴보다는 오히려 팔다리의 접히는 부분, 목의 접히는 부위에 생기며 건조한 습진 형태로 나타나는 경우가 많다. 한편 동양인에게는 십대 이후에 잘 낫지 않는 심한 유두 부위 습진이 나타나는 경우가 있다.아토피 피부염은 나이가 들면서 호전되거나 없어지는 경우가 많지만 호전된 후에도 특정 물질이나 자극에 의해 쉽게 가렵거나 염증 반응이 나타나는 경향이 있고, 성인기에 손 습진이 나타나는 경우가 많다. 성인기까지 아토피 피부염이 남는 경우에는 몸의 피부 증상은 호전되는 반면 얼굴에 홍반과 홍조 및 습진이 나타나는 경향이 있고, 접히는 부위는 오랫동안 긁어 피부가 두껍게 보이는 태선화 피부가 나타난다. 성인기라도 만성 습진만 나타나는 것이 아니라 만성 습진 위에 진물과 딱지가 앉는 급성 병변이 얼마 동안의 시간 간격을 두고 되풀이하여 일어난다."
알레르기 비염 [allergic rhinitis],"연속적인 재채기, 계속 흘러 내리는 맑은 콧물, 코막힘, 가려움증 등의 증상을 보이는 코 점막의 질환","알레르기내과, 소아청소년과, 이비인후과, 가정의학과",코,"비루 , 재채기 , 후각소실 , 비폐색 , 폐쇄성 비음","발작적인 재채기를 연속적으로 하게 되고, 동시에 맑은 콧물이 흐르며, 눈과 코의 가려움증과 코막힘이 대표적인 증상으로 꼽힌다. 재채기와 콧물이 흐르는 증상은 보통 아침기상 시에 심했다가 오후로 되면서 감소하게 되며, 코막힘 증상을 계속 보이게 된다. 가려움증은 코뿐 아니라 눈, 목, 귀 등에도 발생하므로 치료 시 고려하여야 한다.코막힘 증상은 가장 흔히 나타나는 주 증상으로 반 이상을 차지하며 만성적이고 생활의 질을 떨어뜨린다. 그 뒤로 콧물과 재채기 순으로 나타나며, 그 밖에 눈물, 두통, 후각감퇴, 폐쇄성 비음 등의 증상이 있다. 합병증으로 중이염, 부비동염, 인후두염 등이 동반될 수 있다."
