name,simple_description,department,site,simple_symptom,symptom
발목염좌 [ankle sprain],발목을 지탱하는 인대들이 외부 힘에 의해 비정상적으로 신장되어 발목의 통증 및 불안정성을 유발한 상태,정형외과,발목(족관절),"통증 , 부종","통증, 압통 및 종창과 부종이 전형적인 증상으로 급성기에는 체중을 싣고 서기가 힘들 정도이다. 심한 손상의 경우 다치는 순간 인대가 끊어지는 파열음을 들을 수 있는 경우도 있다. 그러나 증상의 심한 정도가 반드시 손상 정도와 일치하는 것은 아니다. 심한 손상으로 발목관절 주변 인대가 파열이 되거나 관절의 탈구가 동반되는 경우 관절의 불안정성이 동반될 수 있으나 다친 직후에는 통증으로 인한 근육 경직으로 확인이 어려울 수 있다. 골절 또는 다양한 관절 내 손상이 동반될 수 있어 이에 따른 증상을 나타내기도 한다."
척추 분리증 [spondylolysis],척추뼈 뒤쪽으로 관절 사이가 좁아져 있는 부분인 협부에 결손이 발생한 상태,정형외과,척추,요통,"관절 사이의 결손이 있는 부위에 요통을 호소할 수 있으며, 특히 허리를 펴는 동작을 할 때 요통을 호소하게 된다. 척추 분리증이 진행되면 척추가 바로 아래 척추에 대해 앞으로 이동하는 척추 전방 전위증이 발생할 수 있다. 가장 흔한 경우로 5번 요추가 바로 아래에 위치한 1번 천추에 대해 미끄러지듯이 앞쪽으로 빠지게 된다. 이러한 경우 다리로 내려가는 신경근이 눌리게 되어 다리로 뻗치는 듯한 통증(방사통)이 발생할 수도 있고, 오래 걸으면 다리가 저리고 당기는 증상(신경인성 파행)이 발생할 수 있다."
구순구개열 [cleft lip and cleft palate],입술이나 잇몸 또는 입천장이 갈라져 있는 선천적 기형,"소아청소년과, 치과, 성형외과, 이비인후과","입술, 잇몸, 입천장, 코, 치아, 턱, 위턱(상악)",폐쇄성 비음,"입술, 잇몸, 입천장이 좌, 우 또는 양쪽으로 갈라져 있으며, 그 정도는 완전히 갈라져 있는 완전형과 부분적으로 갈라서 있는 부분형이 있다. 그리고 입술갈림증의 경우, 입술 표면이 갈라져 있지는 않지만 함몰되어 보이고 특히 입술을 움직일 때 입술 속에 있는 입술 근육이 갈라져서 움푹 파이는 미세형 입술갈림증이 있다. 또한 입천장의 경우도 겉으로 보기엔 갈라진 틈이 보이지 않지만 입천장 뼈가 갈라져 있고 입천장 근육이 가운데에 틈이 있으며 말할 때 콧소리가 날수도 있는 점막하입천장갈림증이 있다."
욕창 [pressure sore],지속적인 또는 반복적인 압박이 주로 뼈의 돌출부에 가해짐으로써 혈액순환 장애로 인한 조직 괴사로 생긴 궤양,성형외과,"전신 마비 환자 중에서 좌골(28%), 대전자부(19%), 천골부(17%)가 압박궤양이 잘 발생하는 부위이고, 급성의 치료 환자, 즉 반듯이 누워 지내는 환자들에서는 36%가 천골부이고, 30%는 족부이며, 6%는 좌골, 대전자부 혹은 복사뼈 부위이다. 우리나라의 경우 전체 발생률은 천골부(57%), 대전자부(12%), 좌골부(5%)로 천골부에 많이 발생하고 있다.","홍반 , 부종","압박에 의해 조직에 산소 공급이 부족해지면 처음에는 피부가 벌겋게 부어 오른다. 압력이 해소되면 바로 원상태로 회복되지만 압력이 지속되고 반복되면 혈액순환 장애가 생겨 조직에 돌이킬 수 없는 변화가 초래된다. 이리하여 물집이 생기고 벗겨지며, 피부 밑 지방이 괴사되어 딱딱해지며, 가느다란 혈관은 혈전증으로 막히게 된다. 죽은 피부는 딱딱해지고 검은색의 괴사딱지(가피)로 변하게 되며 근육세포 또한 괴사가 진행된다. 괴사된 조직이 떨어져 나가면 그 자리가 큰 궤양 형태가 되는데, 궤양의 얕은 층보다 깊은 층이 더 널찍하여 마치 주머니 모양이다."
"상염색체 우성 다낭성 신종 [autosomal dominant polycystic kidney disease, ADPKD]",신장에 여러 개의 물집(낭종)이 생기면서 점차 신장 기능이 감소하는 유전성 질환,신장내과,"주로 신장에 다수의 물집이 발생하지만, 신장 외에도 간, 췌장, 난소 등에 무수히 많은 낭종이 발생하며, 대장 게실, 심장판막 질환이 함께 발생하거나 뇌동맥이 꽈리처럼 부풀어 오르면서 출혈하는 뇌동맥류가 발생할 수도 있다.","복부 팽만 , 혈뇨 , 통증","20대에는 낭종의 개수가 적고 크기가 작아 증상을 느끼지 못하는 경우가 많으며, 30대 이상에서는 낭종이 커지면서 신장이 커다란 혹으로 만져지거나 배가 불러온다. 혈압이 높게 측정되는 고혈압이 흔히 나타나고, 신장 위치에 해당하는 좌우측 옆구리 부분이 아프다. 소변이 붉게 나타나는 혈뇨가 나타난다. 낭종 안으로 출혈이 되기도 하고 신장에 돌(요석)이나 방광이나 신장의 세균성 감염도 흔히 나타난다. 30대 후반부터 50대에 신장 기능이 감소하기 시작하며, 신장 기능이 10% 이하로 감소하면 투석이나 신장 이식을 받아야 한다."
수신증 [hydronephrosis],"어떤 원인에 의하여 콩팥에서 요관과 방광으로 내려가는 길이 막히게 되면 소변의 저류가 발생하며, 이로 인해 막힌 부위 상부의 압력이 상승하여 콩팥의 신우와 신배가 늘어나 있는 상태",신장내과,"콩팥, 요관, 방광, 요도","배뇨지연 , 요실금 , 통증 , 빈뇨 및 야간뇨","요로계가 막히면 통증이 유발될 수 있는데, 이러한 통증 때문에 병원을 방문하여 수신증인지 진단 검사를 받게 된다. 통증은 콩팥을 싸고 있는 피막이나 요 수집관이 팽창하여 발생한다. 통증의 정도는 이러한 조직이 얼마나 심하게 늘어났는가보다는 얼마나 빨리 늘어났는가(팽창 정도보다는 속도)에 따라 결정된다. 요관 결석 때문에 하부 요관이 급성으로 막힌 경우에는 참을 수 없는 통증이 생겨 지속되지만, 만성으로 요관신우 경계 부위 폐쇄가 있는 경우에는 한쪽 콩팥이 완전히 막혀 있어도 통증이 약하거나 아예 없을 수 있다. 소변 볼 때만 발생하는 옆구리 통증은 방광요관역류의 특징적인 증상이다. 양측 요로계가 완전히 막히게 되면 무뇨(소변이 없음)가 발생하는 반면, 장기간에 걸쳐 불완전 요로계 폐쇄가 지속되면 신장의 소변 농축 능력이 감소하여 다뇨(소변량 증가)와 야뇨(밤에 누는 소변)가 동반된다. 따라서 불완전 폐쇄 시에는 소변량이 감소되기보다는 오히려 증가되기도 한다. 이런 경우에 수분을 충분히 섭취하지 못하면 탈수나 고나트륨혈증이 발생할 수 있다. 방광이나 그 하부가 막힌 것이라면 소변을 보기 시작하는 것이 어렵거나 소변을 본 후에도 지릴 수 있으며, 소변을 자주 보게 되거나 혹은 요실금이 발생할 수 있다. 요로계 폐쇄가 있으면 요로계 감염증이 흔히 동반된다. 이때는 심한 발열과 오한이 옆구리 통증과 함께 발생한다. 요로가 폐쇄되면 고혈압도 흔히 발생한다."
카포시 육종 [kaposi’s sarcoma],바이러스에 의해 피부 및 기타 장기에 발생하는 내피세포 기원의 드문 악성 종양,혈액종양내과,"피부에 발생하는 경우가 대부분이나, 실제로 뇌를 제외한 모든 장기에서 나타날 수 있다. 특히 AIDS 연관 카포시 육종은 림프절이나 위장관, 폐, 비장, 간 등을 침범하는 경우가 흔하다.","반점 , 구진","초기에는 대부분 피부에 붉은색 또는 자주색의 부드러운 구진, 반점, 결절이 여러 개 나타난다. 대개 통증이나 가려움증 등의 증상은 없다. 주된 침범 부위는 고전적 카포시 육종의 경우 하지이나, 에이즈 연관 카포시 육종은 얼굴을 비롯한 상체와 점막을 중심으로 전신에 발생할 수 있다. 대개 수년에 걸쳐 서서히 자라며, 진행되면 딱딱하게 변하는 과각질 현상(hyperkeratosis)이나 궤양(ulcer) 형성을 보일 수 있다. 카포시 육종이 장기에 발생하였다면 침범된 장기에 따라 다른 증상을 보이는데, 예를 들어 위장관에 생긴 카포시 육종은 혈변, 장폐색을 초래하고, 폐를 침범하면 호흡 곤란이나 기침을 유발한다."
"파종성 혈관 내 응고 [disseminated intravascular coagulation, DIC]",여러 가지 선행 질환에 의해 응고 촉진인자가 혈관 내로 유입되어 광범위한 혈관 내 혈전 형성 및 출혈을 야기하는 증후군,"혈액종양내과, 감염내과","전신의 혈관에서 일어나는 반응이며, 그에 따른 증상은 모든 장기에서 발생할 수 있다.",토혈,"파종성 혈관 내 응고의 증상은 기저 질환의 종류와 중증도 등에 따라 다르다. 경미한 환자는 별다른 증상 없이 검사 소견에서만 이상이 발견되기도 한다. 혈관 내에 생성된 미세혈전이 모세혈관을 막으면서 손가락이나 사지의 괴사가 일어날 수 있다. 내부 장기 중에서는 폐와 콩팥이 가장 흔히 침범되어 폐색전증, 콩팥겉질의 괴사에 인한 급성 신부전증이 발생하며, 그 외에 뇌, 심장, 간, 창자 등도 증상을 일으킬 수 있다. 응고 인자의 소진으로 전신에 출혈 경향이 높아져 피부의 출혈반과 점막 표면 혈액삼출이 발생하며, 경우에 따라서는 뇌, 위장관 등에 치명적인 출혈이 일어나기도 한다."
노안 [presbyopia],나이가 들면서 수정체의 탄성력이 감소되어 조절력이 떨어지는 안질환,안과,눈,"두통 , 시력 감소","40대 중반에 근거리에서의 시력장애와 더불어 시야가 흐려지는 등이 증세가 나타난다. 먼 것과 가까운 것을 교대로 볼 때 초점의 전환이 늦어지고, 책을 읽을 때 눈이 피로하고 두통이 있을 수 있다. 조명이 어둡거나 작은 글자를 볼 때 증상이 심해지고, 보려는 대상이 멀어질수록 눈이 편하고 잘 보이게 된다."
알레르기 결막염 [allergic conjunctivitis],특정 알레르기 유발 물질에 의한 알레르기 반응으로 발생한 결막(흰자위)의 염증 질환,안과,눈,"충혈 , 눈물 , 눈곱 , 소양감 , 통증 , 작열감 , 결막부종","눈이나 눈꺼풀의 가려움증, 결막의 충혈, 눈의 화끈거림을 동반한 전반적인 통증, 눈부심, 눈물 흘림과 같은 증상을 주로 호소하며, 이외에도 결막이 부풀어오르는 증상(결막 부종), 눈꺼풀이 부풀어오르는 증상이 동반되어 나타날 수 있다. 노란 눈곱보다는 끈적끈적하고 투명한 분비물이 동반되는 것이 보통이다. 알레르기 결막염은 여러 형태로 나타나는데, 대부분은 증상이 경미한 계절성 알레르기 결막염이고, 나머지는 아토피 각결막염, 봄철 각결막염, 거대 유두 결막염으로 나눌 수 있다. 계절성 알레르기 결막염(Seasonal Allergic Conjunctivits, SAC)은 공기 중의 꽃가루, 먼지, 동물의 비듬, 진드기 등이 항원으로 작용하여 결막의 비만세포가 자극을 받아 즉시형 알레르기 반응으로 나타나는 알레르기 결막염이다. 증상이 눈에만 나타나는 경우도 있고, 가끔 비강이나 인후부의 염증도 동반된다. 아토피 각결막염(Atopic Keratoconjunctivitis, AKC)은 대개 아토피피부염과 동반하여 발병하며, 남자가 많고, 10대 후반부터 시작하여 40~50대에서 많이 발병한다. 알레르기 질환의 가족력이 뚜렷하며, 원추각막, 백내장이 많이 발생되고, 망막박리도 보고되고 있다. 원인은 명확하지 않으나 즉시형 알레르기 반응과 지연성 알레르기 반응이 관련되어 있는 것으로 알려져 있다. 봄철 각결막염(Vernal Keratoconjunctivitis, VKC)은 양안성의 만성적인 결막염으로 대개 10세 이전에 발병하여 사춘기에 대부분 없어진다. 덥고 건조한 곳에서 많이 발병하고 남자가 2배 많으며, 가족력이 있을 수 있다. 아토피나 천식, 습진 등을 동반할 수 있다. 50% 이상에서 점상각막염, 미란(표피까지의 얕은 피부결손), 궤양 등의 각막 병변을 동반한다. 거대 유두 결막염(Giant Papillary Conjunctivitis, GKC)은 비감염성 염증 질환으로 거대 유두(0.3mm 이상)가 위눈꺼풀 결막에 나타나는 질환이며 호산구 내의 탈과립이 증가하여 염증 반응을 유발하는 것으로 알려져 있다. 발생에 있어 남녀 차이나 연령 차이는 없다. 대부분 그 원인을 찾을 수 있으며, 연성콘택트렌즈(소프트렌즈), 백내장 수술이나 각막 이식 후 노출된 봉합사, 의안, 공막돌륭술 또는 녹내장수술 후 사용된 봉합사나 특수 기구 등이 자극을 주어 발생한다. 연성콘택트렌즈 착용자의 대부분과 경성콘택트렌즈(하드렌즈) 착용자의 1% 정도에서 거대 유두 결막염이 발견된다."
"원시 [hyperopia, hypermetropia]",망막의 뒤쪽에 물체의 상이 맺혀서 먼 곳은 잘 보이나 가까운 것은 잘 보이지 않는 눈의 상태,안과,눈,시력 감소,"경도의 원시는 조절력(수정체가 두꺼워지면서 굴절력이 증가하여 망막에 상이 맺히도록 하는 능력)이 충분할 경우 특별한 자각 증상이 없고, 시력 장애나 다른 이상 소견이 없는 경우가 대부분이다. 그러나 원시가 심해지면 시력이 저하되고 약시가 생길 수 있다. 먼 거리를 볼 때 원시를 보상하기 위해 수정체의 굴절력을 높이려고 조절이 증가되고, 가까운 거리를 볼 때는 조절이 더욱 증가되어 조절눈 피로의 증상인 시력 감퇴, 눈의 통증 또는 두통, 눈의 충혈, 열감, 건조감, 빈번한 눈 깜박거림, 눈물 흘림이 나타나며, 과도한 조절로 인해 눈 모임이 증가되면 내사위(두 눈으로 보는 것이 방해를 받을 때 한 눈이 안으로 몰리는 것) 또는 내사시(두 눈으로 보는 것이 방해 받지 않은 상황에서도 한 눈이 안으로 몰리는 것)가 생긴다. 소아의 경우는 조절력이 크기 때문에 책을 읽을 때 시력이 저하되면 원시가 있어도 망막상을 크게 하기 위해 오히려 책을 가깝게 하려는 경향을 보이지만, 나이가 들면 원시안에서는 정시안(조절하지 않은 상태에서 눈으로 들어온 평행광선이 굴절되어 망막에 초점을 맺는 상태)이나 근시안(조절하지 않은 상태에서 눈으로 들어온 평행광선이 굴절되어 망막의 앞에 초점을 맺는 상태)에 비해 조절이 더 필요하게 되므로 노안이 빨리 나타나게 된다."
원추각막 [keratoconus],비염증성으로 각막이 얇아져 원추체 모양으로 돌출되는 안질환,안과,눈의 각막,시력 감소,"청소년기에 시작되며 주로 양측성으로 발생한다. 30~40대까지 서서히 진행하며 간혹 급속히 진행하는 경우도 있다. 초기에는 증상이 없고 시력도 정상일 수 있다. 그러나 대비감 감소가 시력 저하보다 먼저 나타나며, 시력 저하는 근거리와 원거리 모두에서 발생한다. 병이 진행되면서 각막이 얇아지고 돌출되기 시작되어 부정난시를 유발해 시력의 저하, 왜곡, 눈부심, 번짐, 단안복시, 눈의 자극감을 호소하게 된다. 원추각막이 진행되어 급성 원추각막 혹은 각막수종이 발생되면 급격한 시력 저하가 발생되며 각막수종은 수주에서 수개월 지속되고 대개 서서히 줄어들어 흉터로 대체되어 영구적인 시력 저하를 유발하게 된다."
익상편 [pterygium],결막주름이나 섬유혈관성 조직이 날개 모양으로 각막을 덮으며 자라나는 안질환,안과,눈,"충혈 , 시력 감소","대개 증상이 없어서 미용적인 이유로 안과를 찾으나 충혈, 자극감, 시력 변화 등의 증상이 올 수도 있다. 익상편이 각막 중심부로 많이 자람에 따라 점차 난시가 증가하며 시축을 침범할 경우 시력저하를 일으키기도 한다. 매우 큰 병변에서는 바깥쪽으로의 눈 움직임의 제한이 나타날 수 있고 이러한 눈 운동의 제한은 재발한 익상편이나 수술 후 흉터조직이 형성되었을 경우 더 잘 발생한다."
뇌염 [encephalitis],뇌 실질의 염증성 질환,신경과,뇌,"구토 , 의식장애 , 발열","뇌염의 증상은 두통, 발열, 오한, 구토, 의식 저하, 혼미, 외안구근 마비, 시력 저하, 경련 발작 등이 있을 수 있으며, 원인질환 및 병변의 위치에 따라 정도의 차이를 보이며, 여러 가지 신경학적 이상이 있을 수 있다. 가장 흔한 바이러스 감염(무균성) 뇌막염의 경우 발병 수일 전 고열과 전체적으로 지속되는 두통을 호소하며 오심과 구토를 동반하기도 하는 증상이 5~7일 가량 지속되며 수막염으로 인해 고개를 숙일 시 통증이 유발되며 목이 뻣뻣한 수막자극 증후가 관찰되는 경우가 많다. 이는 비교적 양성의 질환으로 통증 조절 등의 보존적인 치료 시 열이 떨어지고, 두통도 호전되며, 추가적으로 척수천자를 시행하였을 때 염증 정도가 호전되는 양상을 보인다. 하지만 세균성 뇌막염 혹은 뇌염이나 결핵성 뇌막염 혹은 뇌염, 바이러스성 뇌염 중 헤르페스성 뇌염과 같은 경우 환자가 두통과 오심, 구토, 고열만 호소하다 수일 내에 의식이 저하되며, 안면신경 혹은 외안신경 등의 뇌신경마비를 동반하기도 하며, 양하지 위약이나 대소변장애, 성격 변화와 정신병적 행동, 시력 저하, 경련 발작 및 혈관에 염증이 번지게 되어 발생하는 혈관염에 의한 뇌허혈 혹은 뇌출혈으로 인해 반신 마비, 구 마비 등의 뇌졸중 증상이 발생하기도 한다. 무균성 뇌막염을 제외하고 세균성이나 결핵성 뇌수막염, 뇌염의 경우 머리에 물이 고여 뇌의 압력을 높이게 되는 수두증 등으로 사망하는 경우가 많다."
척수염 [myelitis],뇌와 말단 팔다리 신경을 연결하는 다리 역할을 하는 중추신경계인 척수의 백색질 또는 회색질에 발생한 염증,신경과,척수,근력 약화,"비감염성 척수염인 특발횡단척수염의 경우 증상 발현 후 4시간에서 21일 사이에 증상이 최고조에 도달하는 임상적 경과를 보이게 되고, 반면에 사람T세포림프친화바이러스 유형1(type1)과 유형2(type2) 등과 같은 경우 좀더 서서히 진행하는 과정을 거친다. 이와 같이 임상 양상은 원인 질환에 따라 일부 서서히 진행하기도 하고, 수시간에서 수일에 걸쳐 비교적 급격하게 진행하는 등의 차이를 보일 수 있으나, 대부분 척수염은 빠르게 진행하는 근력 약화, 감각 이상, 건반사 항진, 배변 및 배뇨 장애 등의 조합으로 나타나게 된다. 척수염은 기본적으로 병변이 위치하는 척수 분절의 위치에 따라 몸의 높이를 나눌 때 어느 일정 높이 이하로 감각의 변화가 생기는 ‘분명한 감각 수준’을 보이는 것이 특징이다. 환자는 배꼽 아래로 감각이 저하되었다고 호소하기도 하고, 가슴 아래로 저리거나 통증이 발생한다고 호소하기도 한다. 감각 이상은 침범 부위에 따라 온도 감각이나 통증 감각뿐 아니라 진동 감각이나 위치 감각에 변화가 있을 수 있고, 병소가 경추(목뼈) 등 좀더 높은 부위에 위치할 경우 고개를 숙일 때 찌릿하다고 느끼는 러미트 징후(Lermitte sign)를 호소하기도 한다. 또한 감각 증상 외에도 병변 위치에 따라 팔 혹은 다리, 때론 팔과 다리 모두에 위약이 발생할 수 있으며, 자세의 불안정과 보행 장애가 동반될 수 있다. 그 외 배변 및 배뇨의 장애가 발생하여 요실금, 반사신경탓방광(reflex neurogenic bladder), 변비, 변실금 등이 흔히 동반되며, 자율기능장애와 관련하여 혈압조절 기능 소실이나 발한 장애가 발생하기도 한다. 이러한 증상은 양측성으로 발생할 수 있으나, 반드시 대칭적으로 발생하지는 않는다."
Rh 신생아 용혈성 질환 [Rh hemolytic disease of the newborn],태반을 통과한 산모의 항-D 항체에 의해 태아나 신생아의 적혈구 항원과 결합하여 적혈구가 파괴되는 질환,산부인과,전신,전신 부종,"가장 위험한 증상으로는 태아 수종(hydrops fetalis)이 있다. 용혈이 심해지면 빈혈 현상이 나타나고 이로 인해 저산소증이 나타나는데 이를 극복하기 위해 심박출량이 증가되어 심부전으로 빠질 수 있다. 결국 혈액량 증가, 정맥압 상승, 나트륨(Na) 및 염(Cl)의 체류, 전신 부종 등이 생긴다. 이렇게 파괴된 적혈구를 대체하기 위해 혈구 생성이 늘어나는데, 태아는 성인과 달리 골수 외에 다른 장기에서도 혈구 생성이 일어날 수 있다. 그런 장기들은 간 및 비장이며 따라서 이런 장기들이 커지는 문제도 생기게 된다. 태아는 장기의 기능이 덜 성숙했기 때문에 과다한 일이 부여될 때 처리할 수 없는 상황이 발생할 수 있다. 적혈구가 파괴되면 빌리루빈이 생성되는데 빌리루빈은 간에서 포합과정(glucuronidation)을 거쳐 수용성으로 변하여 장관으로 배설되는 과정을 거치는데 이 빌리루빈이 너무 많아 제대로 포합과정을 거치지 않고 혈중에 많이 떠다니게 되고(과빌리루 빈혈증), 포합과정을 거치지 않은 비포합 빌리루빈은 비수용성 물질로 뇌와 척수의 방어막인 혈뇌장벽(Blood-brain barrier)을 통과하여 핵황달(kernicterus)이 발생하게 된다. 핵황달이 심할 경우 태아는 사망할 수 있다."
대동맥판막 협착증 [aortic stenosis],대동맥판막이 좁아져서 좌심실에서 대동맥으로 혈류가 충분하게 나가지 못하는 상태,순환기내과,심장,"어지럼증 , 가슴통증 , 실신 , 호흡장애","경한 정도일 경우에는 무증상인 경우가 많으나, 중등도 이상으로 진행할 경우에는 온몸으로 혈액이 순조롭게 나가지 못하여 현기증, 흉통이나 실신 등이 나타나기도 한다."
대동맥판막 폐쇄 부전증 [aortic insufficiency],대동맥판막이 완전히 닫히지 않아 대동맥으로 나가는 피의 상당량이 좌심실로 역류되어 들어오는 상태,순환기내과,심장,"호흡장애 , 피로 , 심계항진","대동맥판막 협착증과 마찬가지로, 경한 경우에는 무증상인 경우가 많으나, 중증도 이상일 경우에는 피로감, 활동 시 호흡 곤란, 심계항진, 흉통 등이 나타날 수 있다. 다른 판막 질환과 마찬가지로 시간이 경과하면 심장이 확장되면서 심장 기능이 감소하는 심부전증이 발생하게 된다."
승모판막 협착증 [mitral stenosis],좌심방과 좌심실 사이에 존재하는 승모판막이 잘 열리지 않고 좁아지는 질환,순환기내과,"심장(판막, 승모판막)","피로 , 심계항진 , 가슴통증 , 호흡장애 , 어지럼증 , 실신","승모판막 협착증의 증상은 서서히 나타나는 것이 일반적이다. 좌심실 기능 이상에 의해 발생하는 대표적인 증상은 운동 시 호흡 곤란, 기좌호흡(누워서는 호흡이 곤란하여 앉은 상태에서 하는 호흡), 발작성 야간 호흡 곤란, 피로감 등이며, 드물게 흉통이나 각혈도 발생할 수 있다. 그 외에 좌심실로 흐르지 못한 혈액이 좌심방에 누적됨에 따라 좌심방이 확장되고, 심방세동이라는 불규칙한 맥박이 생겨 심계항진이 발생하기도 하며, 또한 혈액 순환이 원활치 않아 좌심방 내에 혈전(피떡)이 생기기도 한다. 이렇게 생긴 혈전이 심장을 빠져나가 뇌혈관을 막게 되면 뇌졸중이 발생한다. 시간이 더 지날 경우 말초부종, 간종대 및 복수와 같은 우심실 부전 증상이 발생할 수도 있다. 드물지만, 심한 좌심방 확장이 동반될 경우 후두신경이 눌려 목소리가 쉬는 증상이 나타날 수도 있다."
