name,simple_description,department,site,simple_symptom,symptom
간흡충증 [clonorchiasis],기생충인 간흡충이 쓸개즙이 내려오는 통로인 담관에 기생하면서 여러 가지 병을 일으키는 만성 질환,"감염내과, 소화기내과, 가정의학과","간, 담관",설사,"담관에 있는 성충이 물리적, 화학적 자극을 가하여 이상 증상이 나타난다. 증상으로는 배가 더부룩한 느낌, 소화불량, 설사 등이 나타날 수 있다. 담관이 막힐 경우 일반적으로 쓸개즙이 배출되지 못할 때 나타나는 황달이 생기고, 2차적인 세균감염으로 담관염이 발생하여 열이 나고 배가 아플 수 있다. 급성 담관염은 신속히 치료하지 않으면 사망에 이를 수 있다. 이러한 과정이 반복되면 담관이 대부분 막히게 되어 간경화가 올 수 있고 담관에 암이 생길 수 있다."
감기 [common cold],200여 종 이상의 바이러스에 의해 발생하는 호흡기계의 감염 증상,"가정의학과, 감염내과, 호흡기내과, 소아청소년과, 이비인후과","상부 호흡기계, 코, 목","기침 , 인두통 및 인후통 , 비루 , 비폐색 , 재채기 , 근육통 , 발열","감기 바이러스에 노출된 지 1~3일 후에 증상이 나타난다. 증상은 감기 바이러스가 상부 호흡기계에 어느 정도 침투했는가에 따라 다양하게 나타난다. 콧물, 코막힘, 목 부위의 통증, 기침과 근육통이 흔하게 나타나는 증상이다. 성인에게서 열이 나는 경우는 드물거나 미열에 그치지만, 소아에게서는 발열 증상이 흔하게 나타난다. 결막염이 동반되어 눈물이 날 수도 있다. 환자의 연령, 기존에 앓고 있었던 질환, 면역상태 등에 따라 증상의 정도가 달라질 수 있다. 감기의 경과 중에 다른 합병증이 없어도 콧물이 진해지고, 누렇거나 푸르게 변하기도 한다."
광견병 [rabies],광견병 바이러스를 가지고 있는 동물에 사람이 물렸을 때 발생하는 급성 뇌척수염,"감염내과, 신경과","중추신경계(뇌, 척수)","근육간대경련 , 혼수 , 아린감 , 근육통","광견병 바이러스에 노출된 후 증상이 나타나는 데 걸리는 시간은 여러 가지 요인에 영향을 받는다. 따라서 잠복기가 일주일에서 1년 이상으로 다양하지만 평균적으로는 바이러스에 노출된 후 1~2개월이 지나면 발병한다. 머리에 가까운 부위에 물릴수록, 상처의 정도가 심할수록 증상이 더 빨리 나타난다. 초기에는 다른 질환과 구분이 잘 되지 않는 일반적 증상인 발열, 두통, 무기력, 식욕 저하, 구역, 구토, 마른 기침 등이 1~4일 동안 나타난다. 이 시기에 물린 부위에 저린 느낌이 들거나 저절로 씰룩거리는 증상이 나타나면 광견병을 의심할 수 있다. 이 시기가 지나면 흥분, 불안이나 우울 증상이 나타나고, 음식이나 물을 보기만 해도 근육, 특히 목 근육에 경련이 일어나고 침을 많이 흘리며(공수; 물을 두려워함), 얼굴에 바람이 스치기만 해도 목 부위에 경련이 발생하기도 한다. 환자의 80%가 물을 두려워하거나 안절부절못하는 등의 증상을 나타낸다. 병이 진행되면서 경련, 마비, 혼수상태에 이르게 되고 호흡근마비로 사망한다."
한센병 [leprosy],"나균에 의한 감염증으로 나균이 피부, 말초 신경계, 상부 기도를 침범하여 병적인 변화를 일으키는 만성 전염성 질환","감염내과, 피부과","피부, 말초신경계, 상기도","비출혈 , 결절 , 구진 , 무감각증 , 아린감 , 근육통 , 홍반 , 반점","잠복기간은 9개월~20년으로 다양하다. 한센병은 피부에 나타나는 병적인 변화의 종류에 따라 크게 나종한센병(lepromatous leprpsy; 나종나)과 결핵한센병(tuberculoid leprosy; 유결핵형, 유결핵나)의 두 가지 형태로 나눌 수 있고, 두 종류의 중간 단계에 해당하는 다양한 양상이 관찰된다.나종한센병의 잠복기는 결핵한센병의 잠복기의 두 배 정도로 길다. 나종한센병의 경우 전신의 피부에 양쪽 대칭적으로 결절(지름 5mm 이상의 발진)이나 구진(좁쌀 크기에서 완두콩 크기까지의 지름 5mm 이하인 발진) 등의 병적인 변화가 넓게 나타난다. 나균이 코 점막에 침범하면 딱지가 생기고, 코막힘, 출혈 등을 일으키며, 눈에 침범하면 홍채염이나 각막염을 일으킨다.결핵한센병의 경우에는 한 개 이상의 경계가 뚜렷한 피부염이 신체에 비대칭적으로 퍼져 나타나고, 증상이 나타난 피부 부위는 무감각 또는 과다 감각 상태가 된다. 결핵한센병은 특히 말초신경으로의 나균 침범이 심하다.경계형한센병(borderline leprosy)은 치료하면 결핵한센병으로, 치료하지 않으면 나종한센병으로 변한다. 질병의 초기 단계에 나타나는 부정형한센병(indeterminate leprosy, 부정한센병)으로 인해 경계가 불분명한 저색소 반상(반점)이 나타나고, 이를 치료하지 않으면 나종한센병, 결핵한센병, 경계형한센병으로 진행된다. 한센병이 경과되면서 한센병 반응(leprosy reaction)이라는 상태가 나타나는데 이는 질병의 악화를 의미한다. 나종한센병에서는 한센병성 결절성 홍반(ENL:,erythema nodosum leprosum) 반응이, 경계형한센병에서는 역전반응(reversal reaction)이 나타난다."
노로 바이러스 [Norovirus infection],노로 바이러스 감염에 의한 유행성 바이러스성 위장관염,"감염내과, 소화기내과, 소아청소년과",위장관,"근육통 , 구역 , 설사 , 구토 , 복통 , 핍뇨 및 무뇨","사람이 노로 바이러스에 감염되면 평균 24~48시간의 잠복기를 거친뒤에 갑자기 오심, 구토, 설사의 증상이 발생한 후 48~72시간 동안 지속되다 빠르게 회복된다. 소아에서는 구토가 흔하고 성인에서는 설사가 흔하게 나타난다. 두통, 발열, 오한 및 근육통과 같은 전반적인 신체증상이 동반되는 경우가 많다. 발열이 절반의 환자에서 발생한다. 물처럼 묽은 설사가 하루에 4~8회 정도 발생한다. 노로 바이러스 장염은 소장에 염증을 일으키지 않는 형태의 감염이기 때문에 피가 섞이거나 점액성의 설사는 아니다."
대상포진 [herpes zoster],사람 몸의 등뼈 부근에 있는 신경절에 잠복상태로 있던 수두 바이러스가 다시 활성화되면서 발생하는 질병,"감염내과, 피부과","피부, 신경계","농포 , 작열감 , 소수포 , 홍반 , 수포","대상포진은 신경절에 잠복상태로 있던 수두 바이러스가 재활성화 되면서 발생하며 피부의 병적인 증상은 신경근의 지각신경이 분포하는 부위에 국한되어 나타난다. 이 부위에 심한 통증과 감각이상이 동반되며 붉은 반점이 신경을 따라 나타난 후 여러 개의 물집이 무리를 지어 나타난다. 수포(물집)는 수두 환자에서 나타나는 것과 조직검사 결과가 동일하다. 수포는 10∼14일 동안 변화하는데, 고름이 차면서 탁해지다가 딱지로 변하게 된다. 접촉 등에 의해 물집이 터지면 궤양이 형성될 수 있다. 보통 2주 정도 지나면 딱지가 생기면서 증상이 좋아진다. 피부의 병적인 증상이 모두 좋아진 후에도 해당 부위가 계속 아프기도 하는데, 이러한 대상포진성 통증은 노인 환자의 약 30%에서 나타나고 마약성 진통제를 사용해야 할 정도로 통증이 심한 경우도 있다."
월경통 [dysmenorrhea],월경 시에 나타나는 주기적인 통증,산부인과,여성생식기,"구역 , 구토 , 복통","일차성 월경통은 치골 부위 위쪽에서 월경이 나타나기 수시간 전 혹은 직전에 시작되어 2~3일간 지속될 수 있다. 일차성 월경통의 원인은 자궁 근육의 과도한 수축이므로 출산 시 산통과 유사하다. 꼬리뼈(요추천추) 부위의 통증이 동반되거나 앞쪽 허벅지까지 통증이 뻗어갈 수 있으며, 동시에 구토, 메스꺼움, 설사 등의 증상이 나타날 수 있고, 드물게 실신에 이르는 경우도 있다.일차성 월경통에서 나타나는 통증은 복강 내 염증 등에 의한 통증과는 달리 쥐어짜는 것 같은(colicky) 양상이며, 흔히 골반부위의 마사지, 신체 활동 등에 의해 호전될 수 있다.월경 수시간 전 혹은 직전에 통증이 시작되어 2~3일간 지속되는 일차성 월경통과 달리, 이차성 월경통은 월경 시작 1~2주 전부터 시작되어 월경 출혈이 끝난 후에도 수일간 지속될 수 있다.이차성 무월경의 원인이 다양한 만큼 통증이 발생하는 메커니즘 역시 다양하지만, 대개는 골반강 내의 이상 징후에 의해 자궁경부가 막히거나, 자궁 내에 혹이 생기거나, 이물질로 인한 반응으로 자궁근육이 강하게 수축하면서 프로스타글란딘의 생성이 증가한 것이 원인이 된다.이차성 월경통을 가진 여성은 골반강 내 이상이 있으므로 일차성 월경통과 달리 일반적인 진통제(NSAIDs)나 먹는 복합 피임제에 잘 반응하지 않는다."
뎅기열 [dengue fever],모기에 의해 전파되는 급성 열성 바이러스 질환,감염내과,"피부, 간, 뇌","두통 , 발열 , 식욕 부진 , 근육통 , 림프절 비대 , 홍반","갑작스럽게 고열이 나서 발열은 3~5일간 계속되고, 심한 두통, 근육통, 관절통, 식욕부진이 생긴다. 초기에 때로 신체 전반에 붉은 반점이 나타난다. 열이 떨어지면서 온 몸에 피부 발진이 1~5일간 계속되는데, 초기에는 얼굴, 목 및 가슴 부위에 좁쌀 모양의 발진이 일시적으로 나타나다가 3~4일째에 가슴과 몸통에서 시작하여 팔다리와 얼굴로 퍼지게 된다. 전신의 림프절이 커지지만 간이나 비장은 촉진되지 않는다. 코피나 잇몸 출혈 등의 경미한 출혈이 질병 경과 중에 나타난다. 성인의 경우 혈변을 보거나 월경과다, 목 부위의 림프절이 붓는 증상이 나타나기도 한다.뎅기열의 심한 형태로 뎅기 출혈열이나 뎅기 쇼크 증후군(dengue hemorrhagic fever)이 있는데, 이 경우 환자는 열이 떨어지면서 일시적으로 호전되는 것처럼 보이다가 상태가 급속히 악화되는 양상을 보인다. 매우 심한 쇠약감이나 불안증세가 생기고, 식은땀이 나며, 입 주위가 파랗게 되기도 한다. 가슴의 늑막에 물이 차고, 배에 물이 차는 복수가 생겨서 배가 불러지는 현상이 생길 수도 있다. 뎅기쇼크 증후군이 계속되면 장에서 출혈이 생겨 혈변이 나타난다. 이 경우에는 병의 경과 및 치료 결과가 좋지 않아 사망할 확률이 40~50%에 달하지만, 적극적인 중환자 치료를 받으면 사망률을 낮출 수 있다. 일부에서는 뇌염 증상이 동반된다."
인플루엔자 [influenza],인플루엔자 바이러스에 의한 급성 호흡기 질환,"감염내과, 호흡기내과, 소아청소년과, 가정의학과, 이비인후과","기도, 심장, 뇌수막","기침 , 근육통 , 두통 , 인두통 및 인후통 , 발열","두통, 발열, 오한, 근육통과 같은 전신 증상이 갑자기 발생하면서 목이 아프고 기침이 나는 등의 호흡기 증상이 동반된다. 환자가 느끼는 이러한 증상은 매우 다양해서, 감기와 비슷하게 발열이 없는 호흡기 증상만 나타나는 경우도 있고, 전형적으로 고열과 호흡기 증상을 동반하는 경우도 있다."
두창 [smallpox],두창 바이러스 감염에 의해 발생하는 급성 발진성 질환,"감염내과, 소아청소년과",피부,"농포 , 근육통 , 두통 , 수포","갑작스런 고열, 허약감, 오한이 두통 및 허리통증과 함께 나타나며, 때때로 심한 복통과 의식의 변화가 나타난다. 특유의 붉은 작은 반점 모양의 피부발진이 구강, 인두, 얼굴, 팔 등에 나타난 후 몸통과 다리로 퍼져나가며 1~2일 이내에 수포(물집)로 바뀌었다가 농포(고름 물집)로 바뀐다. 농포는 특징적으로 둥글고 팽팽하며 피부에 깊게 박혀 있는데 8~9일경에 딱지가 생긴다. 회복되면서 딱지가 떨어진 자리에 서서히 깊은 흉터가 남아 곰보라고 불리는 피부모양이 생긴다. 미리 예방접종을 하여 면역이 있는 경우나 소두창의 경우에는 증상이 약하게 나타난다.출혈성 두창은 짧은 잠복기가 지난 후 초기에 심한 오한, 고열, 두통, 허리 통증, 복통 등이 나타나며, 거무스름한 홍반이 발생한 후에 피부와 점막에 점상출혈(바늘 머리 크기의 출혈) 및 출혈이 일어나고 치명적으로 발진이 나타난 지 5~6일경에 사망한다. 연령 및 성별에 따른 발병률의 차이는 없지만 임신부에서 잘 발생한다.악성 두창에서는 심한 전신증상이 나타나고, 부드럽고 평평하며 서로 녹아 합쳐지는 피부의 병리적 변화가 나타나며 농포(고름) 단계로 발전하지 않는다. 피부가 미세한 나뭇결처럼 보이고 때때로 출혈이 생길 수 있으며, 환자가 생존하는 경우에는 딱지 없이 회복되지만 중증인 경우에는 피부(표피) 박탈이 심하게 일어난다.무증상의 보균자는 없다."
신경근병증 [radiculopathy],척수에서 갈라져 나온 감각신경이나 운동신경 뿌리에서 발생하는 신경계 손상,"신경과, 소아청소년과","팔, 다리, 경추, 요추","무감각증 , 근육통",신경근병증의 대표적인 증상은 목이나 허리에서 시작하여 팔이나 다리 끝으로 뻗치는 듯한 통증이다. 대개 해당하는 신경분절을 따라 내려가는 양상을 보인다.
라임병 [Lyme disease],사람이 진드기에 물려서 보렐리아균이 신체에 침범하여 여러 기관에 병을 일으키는 감염질환,"감염내과, 소아청소년과","피부, 뇌, 말초신경, 심장, 근골격계","두통 , 근육통 , 홍반","임상 경과는 3단계로 진행된다.1) 초기 작은 부위에 국한된 국소 감염: 진드기에 물린 뒤 3~32일의 잠복기를 거친 후에 피부에 이동홍반(특징적으로 황소눈과 같이 가장자리는 붉고 가운데는 연한 모양을 나타내는 피부 증상)이 나타나게 된다. 피부는 붉은 색을 띠거나 피부가 튀어 오른 양상을 띠며, 병적인 변화의 부위가 커지면서 가장자리는 색깔이 붉어지고 가운데는 연해진다.2) 초기 여러 곳으로 퍼지는 파종성 감염: 수일에서 수주 후에는 보렐리아균이 혈액을 타고 여러 곳으로 퍼지게 되고, 피부 병변의 개수가 늘어나면서 심한 두통, 목이 뻣뻣해 지는 증상(경부강직), 발열, 오한, 피곤함의 증상이 나타난다. 근육통과 관절통이 흔한 증상이며 관절, 건(힘줄), 근육과 뼈를 이동하면서 발생하는 통증이 있고, 대개는 관절이 붓지 않으면서 1~2개의 관절을 한꺼번에 감염시키는 것이 보통이다. 전신의 림프절이나 비장이 커질 수 있으며, 인후통, 마른 기침, 결막염이나 고환 부종이 발생할 수도 있다. 피곤감은 계속 지속되지만 초기의 증후나 증상은 대개 얼마 동안 시간 간격을 두고 되풀이되면서 나타난다. 신경계를 침범하여 뇌수막염이나 뇌염을 일으키기도 하며 일부에서는 심장을 침범하여 부정맥을 일으키기도 한다.3) 후기 지속성 감염: 근골격계 증상과 증후가 주가 되는 시기로, 감염이 된 후 수 개월이 지나면 무릎관절과 같은 큰 관절을 감염시키는 관절염이 발생한다. 기억장애, 기분장애, 혹은 수면장애를 일으킬 수 있고 척수근의 통증을 나타낼 수도 있다."
레지오넬라증 [legionellosis],레지오넬라균에 감염되어 레지오넬라 폐렴 또는 폰티악 열의 증상을 유발하는 감염성 질환,"호흡기내과, 감염내과","폐, 심장, 부비동, 피부, 복막, 신장","호흡장애 , 구역 , 설사 , 두통 , 기침 , 근육통 , 구토 , 복통","레지오넬라 폐렴은 발병 초기에는 밥맛이 없고, 힘이 없고, 머리가 아프고, 온 몸이 쑤시는 증상으로 시작해서 오한과 함께 체온이 39∼40.5℃까지 급격히 오른다. 가래가 별로 없는 마른 기침이 나고 설사, 구역, 구토나 복통 증상이 있으며 발병 3일째부터 가슴 엑스레이 검사에서 이상 증상이 보이기 시작한다. 이러한 폐의 병적인 변화가 점차 진행되면 사망에 이를 수도 있다. 가슴 엑스레이 검사 상에 나타나는 이상 증상과 환자가 느끼는 증상이 반드시 일치하지는 않으므로, 항생제 치료를 시작하여 환자가 호전 효과를 느끼더라도 가슴 엑스레이 사진상 폐렴은 계속 악화되고 있을 수도 있다. 가슴 엑스레이 사진 상 나타나는 이상 증상이 완전히 치료되기 위해서는 증상이 호전되기 시작한 후부터 1∼2개월, 때로는 3∼4개월까지 걸린다. 폐렴 이외의 증상이 동반되기도 하는데 심근염, 심외막염, 부비동염, 봉소염, 복막염, 신우신염 등도 일어난다. 폰티악 열 증상은 레지오넬라 폐렴의 증상과 같지만 폐렴이 발생하거나 사망을 초래하지는 않는다. 폰티악 열은 치료하지 않아도 대개는 2∼5일, 길어도 1주일 이내에 자연적으로 치유된다."
렙토스피라증 [leptospirosis],병원성 렙토스피라의 감염에 의해 다양한 증상을 일으키는 질환,"소아청소년과, 감염내과","전신(혈관, 폐, 뇌막, 간, 신장 등)","근육통 , 결막부종 , 두통 , 구역 , 구토","렙토스피라증은 사람과 동물에게 모두 나타나며 다양한 증상을 일으키는 질환으로, 잠복기는 7~12일 정도이다. 갑자기 시작되는 발열과 두통, 오한, 심한 근육통(특히 종아리와 허벅지), 안결막 충혈이 흔한 증상이다. 이상한 형태의 발열, 수막염, 발진, 용혈성 빈혈, 피부나 점막의 출혈, 간부전, 황달, 신부전, 심근염, 의식저하, 객혈을 동반하는 호흡기 병리적 증상 등도 나타날 수 있다. 유행 지역에서 발생한 대부분의 감염은 증상이 나타나지 않거나 극히 가벼운 증상만 나타나며, 황달을 초래하는 렙토스피라증은 5~10% 정도이다.질병은 수 일에서 3주 정도, 또는 3주 이상 지속될 수도 있는데, 치료하지 않으면 회복까지 수개월이 걸릴 수도 있다. 임상 경과는 렙토스피라 혈증기(또는 발열기, 4~9일 지속됨)와 회복기(또는 면역기, 6일째부터 12일째까지 지속됨)로 나눌 수 있다. 중증 감염인 경우 간부전, 신부전증과 전신의 출혈 징후, 몸의 여러 곳에 나타나는 범발성 응고부전증과 심장염으로 진행될 수 있으며, 우리나라에서는 기침, 각혈 등 중증의 폐출혈형도 볼 수 있다.사망률은 낮지만 연령이 높을수록 사망률이 증가한다. 황달이나 신장 손상이 있는 경우 주의 깊게 치료하지 않으면 20% 이상의 사망률을 보인다. 주된 사망 요인은 간부전, 신부전, 출혈, 성인형 호흡부전 증후군, 부정맥 등이다. 만성 후유증으로 만성피로, 신경학적 증상이 나타날 수 있고, 때로는 포도막염을 일으킬 수도 있다."
말라리아 [malaria],말라리아 원충에 감염되어 발생하는 급성 열성 전염병,감염내과,"간, 혈액","근육통 , 구토 , 발열 , 두통 , 호흡장애 , 구역 , 발작성 빈맥","감염된 모기에게 물린 후 인체에서 임상 증상이 나타날 때까지의 잠복기는 약 14일이지만, 3일열 말라리아의 경우 길게는 1년 정도(5개월∼1년 6개월)까지 간 속에 잠복해 있기도 한다. 발병 후 감염의 전형적인 증상이 순차적으로 나타난다. 한두 시간 동안 오한, 두통, 구역 등의 증세가 나타나는 오한기가 먼저 나타나고, 피부가 따뜻하고 건조해지고 빈맥, 빈호흡 등을 보이는 발열기가 3∼6시간 이상 지속된 후 땀을 흘리는 발한기로 이어진다. 발열 이외에도 환자는 빈혈, 두통, 혈소판 감소, 비장이 비정상적으로 커지는 등의 증세를 보인다. 빈혈은 적혈구가 파괴되면서 발생하고, 파괴된 적혈구와 헤모글로빈이 비장에 침착 되면서 비장이 커지며, 혈소판 감소증은 항혈소판 항체가 형성되어 생긴다. 열대열 원충에 감염되었을 때에는 여러 가지 합병증이 발생할 수 있다. 저혈압, 뇌성 혼수, 간질성 폐렴, 심근 부종 등을 일으킬 수 있으며, 자주 발생하는 질환에는 사구체신염이나 신증후군, 급성 세뇨관 괴사증, 흑수열 등이 있다."
매독 [syphilis],트레포네마 팔리듐균에 의해 신체 전반에 걸친 감염 증상이 나타나는 염증성 질환,"감염내과, 산부인과, 비뇨기과, 피부과","성기, 피부, 점막 부위, 심장 및 대동맥, 눈, 뼈, 신경계, 구강 등","근육통 , 인두통 및 인후통 , 변비","1기 매독의 주요 증상은 통증이 없는 피부궤양(chancre)이다. 대부분의 경우 한 개의 궤양만 관찰되지만 여러 개가 발생하는 경우도 있다. 매독균에 접촉된 후 궤양이 발생할 때까지는 10일에서 90일 정도의 시간이 걸린다. 궤양은 단단하고 둥글며 크기가 작고 통증이 없다.이 궤양은 매독균이 피부접촉을 통해 들어간 그 부위에 생긴다. 주로 발생하는 곳은 성기 부위나 항문 주위 등이다. 통증이 없는 궤양은 3~6주 정도 지속되며 특별한 치료 없이도 자연적으로 호전된다. 그러나 매독에 대한 치료를 시행하지 않으면 2기 매독으로 진행하게 된다.2기 매독은 피부의 발진과 점막의 병적인 증상을 특징으로 한다. 발진은 1기 매독의 증상인 통증이 없는 궤양이 치유되면서 나타나거나 또는 치유된 후 수주가 지난 후에 나타난다. 발진은 전신에 걸쳐 발생하는데, 특히 손바닥과 발바닥에 나타나는 발진은 매독에 특징적인 증상이다. 발진 이외에도 발열, 눌렀을 때 아프지 않은 임파절 종대, 인후통, 두통, 체중 감소, 근육통 등의 증상이 함께 나타날 수 있다.잠복 매독은 1기와 2기 매독의 증상이 사라진 후에 시작되며 치료를 하지 않는 경우 체내에 매독균이 계속 남아 있을 수 있다. 이러한 잠복 상태는 수년까지도 지속될 수 있다. 3기 또는 후발 매독의 증상은 주로 내부 장기의 손상으로 나타나며, 중추신경계, 눈, 심장, 대혈관, 간, 뼈, 관절 등 다양한 장기에 매독균이 침범하여 발생한다.중추 신경계를 침범하는 신경매독의 경우 증상이 없거나, 뇌막 자극 증상, 뇌혈관 증상 등이 발생할 수 있다.- 1기 매독: 세균의 침범부위에 발생하는 무통성 궤양- 2기 매독: 피부 발진, 점막의 병적인 변화- 3기 혹은 후발 매독: 다양한 내부 장기 침범. 눈, 심장, 대혈관, 뼈, 관절 등- 신경매독: 뇌막 자극, 뇌혈관 침범"
무균성 수막염 [aseptic meningitis],여러 가지 감염원에 의해 유발되는 뇌수막의 염증 상태,"감염내과, 신경과, 소아청소년과",뇌수막,"근육통 , 구토 , 두통 , 구역 , 설사","대부분의 경우 두통과 발열, 목을 앞으로 구부렸을 때 뻣뻣한 느낌이 나타나는 수막 자극징후가 나타나고, 이러한 증상은 갑작스럽게 시작된다. 발열로 인해 체온이 38~40도 정도로 올라간다. 두통은 다른 발열 질환에서보다 심하고 보통은 머리 앞쪽이나 눈 뒤쪽이 아픈 경우가 많다. 수막 자극징후는 초기에는 증상이 가볍기 때문에 발견되지 않을 수도 있다. 이외에도 전신 무력감, 근육통, 식욕부진, 구역, 구토, 복통, 설사, 어지럼증, 졸림 등의 일반적인 증상이 동반되는 경우가 많다. 하지만 뚜렷한 의식저하 증세나 국소신경학적 징후가 나타나는 경우에는 무균성 수막염보다 다른 뇌실질의 병적인 변화를 의심해 보아야 한다."
발진티푸스 [epidemic typhus],세균의 한 종류인 발진티푸스 리케치아에 감염되어 발생하는 급성 열성 질환,"소아청소년과, 감염내과",전신,"혼수 , 두통 , 근육통","증상은 다양하게 시작된다. 1∼2주의 잠복기 후 갑작스런 두통, 오한, 발열, 허탈, 전신의 통증 등의 증상이 나타난다. 가피(eschar)는 보이지 않으며 반상 모양의 발진이 5∼6일째 몸통 상부에 나타나기 시작하여 전신으로 퍼져 나간다. 그러나 얼굴이나 손바닥, 발바닥에는 발진이 나타나지 않는다. 의식장애, 헛소리, 환각 등 중추신경에 관련된 이상 증상이 나타날 수 있고, 발열기에는 맥박증가, 혈압 저하 등의 순환기 장애가 나타난다. 대부분의 경우 중독증상이 뚜렷하게 나타나지만 2주 후에는 열이 내리고 상태가 빠르게 좋아진다."
